Title,Company,Location,PostDate,ExtractDate,Summary,Salary,JobUrl
Business Intelligence Data Engineer,Golden State Foods,"Irvine, CA",14 days ago,10-29-2020,"Provide application analysis and data modeling design to collect data for centralized data warehouse.
Map source system data to data warehouse tables.",,https://www.indeed.com/pagead/clk?mo=r&ad=-6NYlbfkN0AbRDI-lGFs5QlqkohoUB2e5sgCs9HeEJ9hgGj-UwEHEp6HU_wDtQH-DctAHXoIBBURi2bymK4Y27QbYvWtXiEiDWi44xXKOyQ46pBE_CTCeWXG2gZDuByA9p-d1lxLoK_Vqk0G1RPuYiqs8ZY33sIm4buAabCv7BodlzvEQOYMi01Z-RYc0SRnk9rVVlXWw5uz645ebEBvVrIXyOVOX2an7V2BBs4LSefn8IqHU_NXlCb2h1MgDQP4tRhfi6AhFCmFB8ihCeTd27qKqIJYO0LPXmn52Bv5d335hDFuqCvj4sgIKGqDKznpLLkHwO0UOGA9v6_ObH-jwpcQKnQif9ZUTPfeFfjFGrceRw2O0W60zx7pl_dMUAkeSBGKMdzMRwGkvQUTHHdsYV_CUhfCCSzSSjN1HwVZ7jheLT_uhUYZHE_idX7tUuFdDLoiIdk2wxml7xTuITiCSCUqdHzq5xQnfNO8CC6pOzldb0AD1YRRAg==&p=0&fvj=1&vjs=3
Data Engineer,Itility,"San Diego, CA",8 days ago,10-29-2020,"As Hadoop data engineer, you are responsible for the functional part of provisioning data - eg building data inserted pipelines and data connectors.","$80,000 - $125,000 a year",https://www.indeed.com/pagead/clk?mo=r&ad=-6NYlbfkN0CHMQdqSgwEG8kiMfPxdvpQEyd6VhWmdX3N1gBfyFHBJtVvgJvpm7HvHrjtCPT_OD71X1gY5yOAKTMF4dP6PXGabc0ghyCplinY-NIg3MWHm6My0FmspfGmqkQPYx61RMPQKhFSW_xd20QsxQ1rxd4w4ak2XtNFCywO64PtokIz5f9OwNvndIH0kPeNUJ7rt3S1oBFoGlpoLmsLB6k0J5YlAS7vyZji3ZUwLZZ-3I0hG4Ewfo6pSouA_M6ZOgv4XG3R33ZmBXqPDUkNF0HBmBXn8bwhf4H-rlObHWwF6PJ6RpF4rVVYeP64pjyGCRyxMOOFeozsWIaS8I3hft_uuolGxiwG7q1TleZWmHmXi2zOzPype9zt5YjxVIRp3oIQFxU_96EETt8g_aLWel2FSAb_sK4-wvFC7MDeAvPtIjbtRvDB_0MVG1mfNO_gsjcmhqZ8m6DH2GTZvA==&p=1&fvj=1&vjs=3
Salesforce Advanced Software Engineer- Information Technology,Veterans First Mortgage,"Salt Lake City, UT",6 days ago,10-29-2020,"This position will be responsible for all technical aspects of Salesforce.com, including custom code, data migrations, data quality, systems integrations, third…",,https://www.indeed.com/pagead/clk?mo=r&ad=-6NYlbfkN0Cta0q3Fn-II_B5T1-oabtLlHx-de18-iz89De6JCiCnOPvT-mytxiu88NZ9BzDYMz2e3tqIiIVX6bBu76B6nRiRWN5UltjffDYjTMhclspCchKpaG4wwoqYG2AedHRjAqtOZ80tr3Lto4_WJEBJvaBi3yklfFqxInTnI7RplW1RUBp236JZEfuLAgKCk9eQJKQcw6y7G0hjgD7kbICL0fx3nPXLmYhj85OQ4XdDus5qxP5QdrvvKvdEwwEZodZEE2O3q3VlfMEh8ZtB8EH_m-Gn0wg90w-E9BpjrZDsSnUHGaRg8jSMnsSXhyK2RW4RlwPjcQ9ihzhg4afAetq4QYzSZoVef4v7x7PCkmZ9Nl758hL2MGEL-am_G3XTFBFaGw-7-jn2_qrOpFLC6awQeMx_zJvxu57yTTDCGNyyH1x4z0jef9B1Pr_Igf2GrUo5-AyABySOqcIHO41Drz2SGksZ8QaMvUHjz7C5tBy4N4LJ-HxtwDXL5mgIp_G8U9CaEYV_U1zXowiLCWzQqpn0_igURTeGv5k3ssqiVYzg6maCg==&p=2&fvj=0&vjs=3
Senior Data Engineer,Rinchem Company Inc.,"Albuquerque, NM",7 days ago,10-29-2020,"Minimum of 10 years of experience as a data engineer or data architect.
Experience with both normalized and dimensional data models, structured and unstructured…",,https://www.indeed.com/pagead/clk?mo=r&ad=-6NYlbfkN0Dg9jke5OYs_Zwj6ej1fxox5y0ndh4lAJ490Efsm_eZDPK8xNs0pzaxQSqXzPSsw9n2csRFx3Kp0kqHCLasPt84GYHFDdzXhDEKPLRnG9t0ztauJpZ8Sc5OeNBvq-McZ2w8dqgDH-SnvZNYGVV8WI3cnXHfqd-z9yi0KYzJrPIpQFAms52axIyWG8x8AQ7QS5BXKhexyqBxkXGgJ-U7wAqrrE27DDEaoQcHLmJ8xN4ZEoAImMKWUvYfQ7c21H8Wh2neB0ml4zuBHvAkcgdKyYkoiWSLWnOpZ295DcxACoFAklVq0cSX97J-RdmaaXyX4X9_IQZNcz9b6cOJV4M9zDqP1vnSYsiisizlDlf7rSAlCL1yYNn23AwuE_OUP6-rnMG-kPUMWM_Qy5XM3Ld_mEiNIj99K1lrIuc9RMulzVfgY0C6Co-Z8vFpdleXL1LNoLdgOtFXio5oqOkNZJVH1si-&p=3&fvj=1&vjs=3
"Data Engineer / Clearance Needed / Fort Bragg, NC",Lockheed Martin,"Fayetteville, NC",Just posted,10-29-2020,"Experience building and optimizing ‘big data’ data pipelines, architectures and data sets.
The ideal candidate is an experienced data pipeline builder and data…",,https://www.indeed.com/pagead/clk?mo=r&ad=-6NYlbfkN0CBo8qKybRb57wAxhfWDRtyUPVOgEgWgSDOADQxJ3V9H0tz0qBJHU48DEZ0eVgbTpI_-dXgGOvl61I63auBH0RwCscpilNpwk3t7_c8c8s2W3N7E3P2iYqNtwPv1-muGzeXLDjmy6uBquwrQwXumK8oVVuP4qLY_AhlIb_vQu2qrrxLbEpSKnqF7_tTSorBEpGpa5EQNGA3C0djMmWnGyPh7RbBWXleXkSGqU-1YmJQUeeiD563CScvlCagOafOHSvcqOKjaPaJnCWrg-b443fnL9Ti27j-eeoXEjYEawzbVE6eCZYLxwPiewuVdYAcSNwkXc050No0QGzMTD53Ismyp9yhu1J320kKfvtmdRdKb9VMs6yo50ZrROLqr223hgf4wK6vGthvlw==&p=4&fvj=0&vjs=3
Data Engineer,ProVantage Corporate Solutions,"Raleigh, NC",8 days ago,10-29-2020,"Design and consult on a big data project for our new product.
The ideal candidate is comfortable with a mixed role that encompasses multiple facets of the data…",,https://www.indeed.com/pagead/clk?mo=r&ad=-6NYlbfkN0Alzi3G-ZU2qu23LvS7-EjJWw1ZAX8pKlLmsj8sjw4-23XbJXYERZDkIc3Q_Lb0CQPNspX61DI4yQAHH0gL1neEGrd3VoNq25Y77arN-nHNwff7HJwWxHvUVKMSq4sRAPNBxsQSODuch1Y5fA0fr84yO-umribkUnPsjxlmk-Ddd1BWSAiL9CL6mY65qcFPnTiPaV6GTBX-I-Y5SebU0JARtm1542xXsgMDdJaqn2MM58Qv_DSb-a5X5BeymSlkztL-BxmsomuDDU4nfjXt5yVBJhXZTmeaCSs2thUDythwmy0Oj--rpA7-EKcqu3ataGYS5IzUC26PahxY_GBDI6HQryNw1_mygb1jNXD83YeyyFJV1KgxaFhMFPXdySbzYIHaL_vvhxve_KaWUqvEh5AKK_RJ9Avw80BhTvN2lxtZr28iWHHVa3ckTp_UT6CgWEB65zEO-Tu6D-N2JZCRHQFd6aqd1mcCCA-r5yL-Tef1dBEBALOySMT6&p=5&fvj=0&vjs=3
Cloud Data Engineer,Horizontal,"Eagan, MN",1 day ago,10-29-2020,"Experience driving and developing medium complex data integration solutions using two or more of data management software tools.
Big Data and NoSQL experience.",$90 an hour,https://www.indeed.com/pagead/clk?mo=r&ad=-6NYlbfkN0DVLD0NwOQENOe9ZSCJLsOt28qZmO4545ePKxrhyheH8ozpOzhav8ejIYdQ_MchV7lZ8ZG_hnyFbPFplqsiGvDyX5mjK4Pntg8RGfnWcy1CFHZCEL8GOkb6QYXsUeosjdYz-eYA3ZBQzVwZtSxMDQhNdSYpla5RGoN-kxClDErNxXnX7uiXCzQoK4pueSnAdSHVUsxvf4mHxkXUlKzxFHR7ENFTono15QLX-WX9qZsj7exgMljeu22uF0uKNDpkxxakdNmnuTzYLrN3ZMUaGavdecCTV-SYb_a76VNkdhCzZ1tmcytWQvT_Wm7sQ-n0nk6KtIlS5iO8ku-QLyJx5U201c-n3cdaEZGxiFwZx6dG9jH6OKSVa-JdBSxIeujvhtWbW-5MgIcjqetlWiuDp3GT30_Ds_4vMBcz6Xc2wCubJloGRPJgXj6pb4KSOd66qrT-mszaDb6zSmcEjlQnkrcCCzRXlgTde4Ow4KF_UEMss0pB-WvN2NTD32hIohww9L6maAe55kDMsXKtzt5p9gezy86T9gRFkEoKe5SdT7AbiEcc8v-BiRqwv0ie-8C7NEYgexYCl3J9ODHHEMSbFMypjChVc4V6dHZWPtKMkpL71oyQvn0VriAawIfSviSqb0pIi0LkC1332zsMZusnkspNyUN4II82FqJ5QuId5WVi4ieuSO_OStg1NZVdG0pFHKrfwTE4ylCoaXCKqdPwbshr6srJqcykeXCmSE9ip1zqOX-YefcSafQsS1adwar8mTBYivHtyCqWUPQOGs5D6nZNgPXASBe5XNS1VYcRsM0sikS--h_hO5wVspC8YwaMIGcx4zitWVA_Ej6mPSTIqrYRdNyCwZWlFuPxXtpELyUKphQcfp0mZVs3li50Ck5Z5WtsXjuDEgZKgB2b9ayAv6kIVTlt_ljOkifK5FvDx1VFPi6ivEXv2b8nqo4caVvoWzKq9fmQTk-h6bRuhczSyhWOivKOFxPfcgvnkR5dJTdF4Q==&p=6&fvj=0&vjs=3
Data Engineer,J & C Associates Ltd,"Kingdom City, MO",Just posted,10-29-2020,"Convert element of the existing SQL based solution to automate mi jobs on sap data services (V4.2), experience of BO and DB2 required 4.",,https://www.indeed.com/rc/clk?jk=005d4951f6d3e6b6&fccid=1685770ff9dd7777&vjs=3
Data Engineer,Binary tech consulting corp,"Redmond, WA",2 days ago,10-29-2020,"Azure data bricks, SQL) - (Azure SQL, SSIS, ADLS).
Client is seeking a 10 Yrs Exp Profile.
Software development: 1 year (Preferred).",$43 - $73 an hour,https://www.indeed.com/company/Binary-tech-consulting-corp/jobs/Data-Engineer-a6d16b8d8bf0b58d?fccid=92926768a4445bd3&vjs=3
Data Engineer,DataPattern,"Cambridge, MA",2 days ago,10-29-2020,"9 years of overall IT experience with at least 3 years of experience in Big Data (Hadoop, Spark, AWS).
Should have experience with “R” programming.",From $55 an hour,https://www.indeed.com/company/DataPattern/jobs/Data-Engineer-7e7053471f597dc7?fccid=37a615ec01506c9f&vjs=3
Data Engineer,Michael Bailey Associates - UK Contracts,"Kingdom City, MO",1 day ago,10-29-2020,"Experience working with large-scale data environments.
Experience in leading data engineering projects is a big plus..
Data Warehouse and Data Lake solutions.",,https://www.indeed.com/rc/clk?jk=1a9ce8a3cb929384&fccid=6131b5f01b171b34&vjs=3
Data Engineer,Seattle Kraken,"Seattle, WA",1 day ago,10-29-2020,"Build data quality assurance tools to ensure data integrity.
Experience with ETL data processing.
Experience with creating APIs to access data.",,https://www.indeed.com/rc/clk?jk=24efbb364565678f&fccid=b3bb074247fb26be&vjs=3
Data Engineer,Epace Technology,United States,1 day ago,10-29-2020,"Deploy inclusive data quality checks to ensure high quality of data.
Develop technical solutions to improve access to data and data usage.",,https://www.indeed.com/rc/clk?jk=ab3e62fc4147b55b&fccid=28cf12cd52776c04&vjs=3
Data Engineer,Platform.sh,United States,Today,10-29-2020,"Build batch and real-time data pipelines to ingest and process data from various sources such as product backends, third party platforms, etc.",,https://www.indeed.com/rc/clk?jk=966b6327465cccff&fccid=19052431ee586316&vjs=3
Data Engineer,McDonald's Corporation,"Chicago, IL",1 day ago,10-29-2020,"The role will work closely with data scientists and ML engineers and includes designing, architecting, and building data pipelines to support business use cases…",,https://www.indeed.com/rc/clk?jk=fcf1d24fda1434b8&fccid=f753bb1a40104d82&vjs=3
Data Engineer,ABCS Corporation,"Phoenix, AZ",8 days ago,10-29-2020,"Understanding of data architecture concepts such as data modeling, metadata, workflow management, ETL/ELT, real-time streaming), data quality.",$75 an hour,https://www.indeed.com/company/ABCS-Corporation/jobs/Data-Engineer-00231ba8fda3c758?fccid=42f230a67af9c6a0&vjs=3
Data Engineer,Course Hero,"Redwood City, CA",1 day ago,10-29-2020,"Work with our teams of data scientists, machine learning engineers and software engineers to work efficiently and reliably with terabytes of data.",,https://www.indeed.com/rc/clk?jk=13d42e0465c13ae0&fccid=569fb056870f3220&vjs=3
Data Engineer,Playwire Media,"Boca Raton, FL",8 days ago,10-29-2020,"Architect and maintain data pipelines, data lakes, and databases, both independently and as part of a data engineering team.
Temporarily due to COVID-19.",,https://www.indeed.com/pagead/clk?mo=r&ad=-6NYlbfkN0DFEPsj5XEEyDxXTSiircIR4WX4droDDGOVg6pfRRvBm6JZlzQwmh-BKo_XhS1f0ACQbg1zBX-bnC58MZ2kfSJSL7g1pn0FFVEWN0oEc9RIt_fxzElF8SlvS2mIsVC7uXH1Fv_3cPJgIjhvxmn6hctJIoY1o_pvYCvBavul5eI_ADXVqW3mUs3xUhmYakeX2KZCU8MyPPenZnxm7EepaXlamIS5Vw0L4ZshubjvlTMUGoKRSW7jkzaHJbFZislzUnuwnkfdD8DyZlRNtqxC6IGO2sY0KsqNgx_83KmDOKBJNe_99TAb_6q-lA-kDQqInQDgaXFdDqHq8vOQ_L795Q7yXe9UDNWShf3OWJKDC4ekYrEn1LFdSjJcTtspLm9PoH882hWXYNjPcMHOG8yIerVlvdS6E3ru0358CNBFGMLQqdINMAihQH0GtT2DV_yP0OnJwC6w8hTliQ==&p=17&fvj=1&vjs=3
Data Engineer - Mid Level,USAA,"Fountain Hills, AZ",2 days ago,10-29-2020,"Analyze data and enable machine learning.
Help on-board entry level engineers.
Data Engineers deliver quality reporting and data intelligence solutions to the…",,https://www.indeed.com/pagead/clk?mo=r&ad=-6NYlbfkN0CdTBpsLrhs4IwmIsoO0brdHaF9POTtXIeJjdlamKYQ_HWXH6wnIvGc8UGs1d70_o1FI6_nx3Fvo4mnocXf6yaCsbKn7mQJCkxHvx-6rVs0rcRSlzTxru6TFjlOrXzTMzAkT_j8w-DMVAQLSbcCdD9RaABWgQ0KxkogeKy7p_k3ZsJLe7MCtQEDXsN0j24hAQFAcxWzH0XUjdbFzt4-90rwlQBFyFu55Cghvgmce505RVTUrxNyExwxibrPi5shfLU_zZabOmgeUbw-9NqH5HhoByH3h-HYNrff5o1JgXDAY0KFaNXP5TFQRoKr1Srp21gLpnm_Z6B7YIsVo64g55hQ18f0WFYOtsf5hAWzaSIwPr7cRZI3CilDLVrn9eP7gYQ=&p=18&fvj=0&vjs=3
Data Engineer,Michael Bailey Associates - UK Contracts,"Kingdom City, MO",1 day ago,10-29-2020,"Experience working with large-scale data environments.
Experience in leading data engineering projects is a big plus..
Data Warehouse and Data Lake solutions.",,https://www.indeed.com/rc/clk?jk=1a9ce8a3cb929384&fccid=6131b5f01b171b34&vjs=3
"Entry-Level Data Positions (Data Engineer, Machine Learning & Visualization)",Citi,"Jacksonville, FL",13 days ago,10-29-2020,"Knowledge of the principles of software engineering and data analytics.
Here, you will scale our data science models into production-level applications.",,https://www.indeed.com/rc/clk?jk=d2e8a5eaac52a039&fccid=5bcd1ef0a7f4fb99&vjs=3
Data Engineer,Cognizant Technology Solutions,"Bloomington, IL",Just posted,10-29-2020,"Designing and coding Hadoop applications to analyze data collections.
Bachelor’s degree in Software Engineering or Computer Science.",,https://www.indeed.com/rc/clk?jk=00c917aa8f5e1c07&fccid=2df6a1e69a70a1e7&vjs=3
Data Platform Engineer,Pantheon,United States,Just posted,10-29-2020,"Experience supporting data scientists and analysts through PaaS.
Create an automated, state of the art, data platform for various job types and sizes.",,https://www.indeed.com/rc/clk?jk=b13eb1efb03b1e99&fccid=dd616958bd9ddc12&vjs=3
Data Engineer,FlexIT Inc,"Beaverton, OR",2 days ago,10-29-2020,"Must be able to execute and deliver data pipelines.
Establishes database management systems, standards, guidelines and quality assurance for database…",,https://www.indeed.com/rc/clk?jk=e011aef49e4a08b4&fccid=2f3a12745010baf7&vjs=3
Data Engineer I,2U,"Brooklyn, NY",10 days ago,10-29-2020,"Maintaining data pipelines & data systems.
The team is responsible for 2U's analytical data warehouse and supporting data pipelines.",,https://www.indeed.com/rc/clk?jk=a6d810f567143e91&fccid=8f236bae1b36b1dc&vjs=3
Data Engineer,Recorded Future,"Boston, MA",6 days ago,10-29-2020,"Find ways to use our own data to make our data processing more efficient.
Build code and user interfaces to manipulate data at scale and expand our use of…",,https://www.indeed.com/rc/clk?jk=de8e493d8e74331f&fccid=b276df3fa16c132a&vjs=3
Associate Data Engineer,Blue Cross Blue Shield of Louisiana,"Baton Rouge, LA",2 days ago,10-29-2020,"Completion of a data engineer or relevant internship program.
Support of a data warehousing, data mart, data lake, and/or business intelligence environment.",,https://www.indeed.com/rc/clk?jk=2e3f5b33ed30b89a&fccid=4f8f5d6678a5792a&vjs=3
Data Center Engineer,"UPPER, LLC","Columbia, SC",10 days ago,10-29-2020,"UPPER holds a database of qualifying Engineers.
Data Center: 1 year (Preferred).",$30 - $40 an hour,"https://www.indeed.com/company/UPPER,-LLC/jobs/Data-Center-Engineer-2b1986f69572d30c?fccid=ce1301670fc29522&vjs=3"
Data Engineer (Virtual),Amazon.com Services LLC,Remote,2 days ago,10-29-2020,"Experience with data modeling, data warehousing, and building ETL pipelines.
Familiarity with data quality automation.
We need a Data Engineer!",,https://www.indeed.com/rc/clk?jk=c9a211cb008153ab&fccid=fe2d21eef233e94a&vjs=3
Data Warehouse Engineer,Standav Corp,"San Ramon, CA",3 days ago,10-29-2020,"Perform data profiling on large, complex data sets and provide insights into data quality challenges.
Build, maintain, and improve data models, dashboards, and…",$60 - $63 an hour,https://www.indeed.com/company/Teknett/jobs/Data-Warehouse-Engineer-519ad1f8efc7b24d?fccid=4bbc7a11efd7393c&vjs=3
EMC Avamar Data Engineer,Infogain,"Watsonville, CA",6 days ago,10-29-2020,"Avamar software provides source-based deduplication, reducing data at the server before the data is moved to the backup target.
EMC Avamar: 1 year (Preferred).","$84,242 - $102,962 a year",https://www.indeed.com/company/Infogain/jobs/EMC-Avamar-Data-Engineer-be388f898780116e?fccid=3c566800dc2b9808&vjs=3
Data Engineer,"Avineon, Inc.",Remote,7 days ago,10-29-2020,"Warehousing, data cleaning, data pipelines, and other analytical techniques required for data usage.
Proficient with data models, large datasets, business…","$87,378 - $120,000 a year","https://www.indeed.com/company/Avineon,-Inc./jobs/Data-Engineer-7fe8606c0ad8b6ae?fccid=d9257ebf47059952&vjs=3"
Data Engineer - Minecraft,Microsoft,"Redmond, WA",4 days ago,10-29-2020,"As a BI data engineer specializing in scalable ETL, you are an expert in designing, developing, and maintaining secure, scalable data warehousing, data…",,https://www.indeed.com/rc/clk?jk=1b66f3152e0a47df&fccid=734cb5a01ee60f80&vjs=3
Data Engineer II,Medical University of South Carolina,"Charleston, SC",3 days ago,10-29-2020,"Under indirect supervision, the Data Engineer II provides a variety of operational, technical and collaborative functions within the data Management function of…",,https://www.indeed.com/rc/clk?jk=2d013b4c722da2cf&fccid=a0cb52b0fb3555b4&vjs=3
Data Engineer,"Talmetrix, Inc","Cincinnati, OH",3 days ago,10-29-2020,"As the Data Engineer at Talmetrix, you’ll spend most of your day analyzing client data feeds, producing plans for normalization, then utilize the appropriate…","$55,000 - $75,000 a year","https://www.indeed.com/company/Talmetrix,-Inc/jobs/Data-Engineer-35b3c81c2f1d0ce8?fccid=548ea2b44d0343ae&vjs=3"
Data Engineer I,2U,"Brooklyn, NY",10 days ago,10-29-2020,"Maintaining data pipelines & data systems.
The team is responsible for 2U's analytical data warehouse and supporting data pipelines.",,https://www.indeed.com/rc/clk?jk=a6d810f567143e91&fccid=8f236bae1b36b1dc&vjs=3
Data Engineer,eTek IT Service | Savvysol,"Hoboken, NJ",9 days ago,10-29-2020,"Need a data engineer, not a machine learning engineer.
Functional Programming in Scala as well as data-parallel operations.
Must have master’s degree.",$55 - $65 an hour,https://www.indeed.com/rc/clk?cmp=eTek-IT-Service-%7C-Savvysol&ti=Data+Engineer&jk=2ba52e101163e7c6&fccid=b799b629b7493305&vjs=3
Associate Data Engineer,Housecall Pro,"Denver, CO",3 days ago,10-29-2020,"Solid understanding of data warehouse design and data modelling standards.
You have experience in data warehousing and working with relational databases for the…",,https://www.indeed.com/rc/clk?jk=a489f8eb9c12a2f8&fccid=b75cc522790c4603&vjs=3
Data Engineer,OverlayAnalytics,"Dallas, TX",7 days ago,10-29-2020,"Navigate new data sets frequently and model data efficiently and effectively.
Experience in developing and maintaining ETL/ELT data pipelines.",,https://www.indeed.com/rc/clk?jk=c9228a03cff9c6d2&fccid=e530731ee79de0b9&vjs=3
Data Engineer Intern,Warner Bros. Entertainment Group,"Needham, MA",7 days ago,10-29-2020,"Learn the internals of building a robust end-to-end data pipeline on all levels especially in databases, data modelling, data processing infrastructure and…",,https://www.indeed.com/rc/clk?jk=c9b4ad5a891de29b&fccid=30cc7a5451d4ee77&vjs=3
Data Engineer,Essence,"New York, NY",2 days ago,10-29-2020,Support the development strong working relationships with third-party data providers that we rely on for access to necessary data.,,https://www.indeed.com/rc/clk?jk=5a03807b849b4d9b&fccid=26865d82c27c8d42&vjs=3
Data Engineer (Virtual),Amazon.com Services LLC,Remote,2 days ago,10-29-2020,"Experience with data modeling, data warehousing, and building ETL pipelines.
Familiarity with data quality automation.
We need a Data Engineer!",,https://www.indeed.com/rc/clk?jk=c9a211cb008153ab&fccid=fe2d21eef233e94a&vjs=3
Data Engineer,"Stefanini, Inc","Richmond, VA",2 days ago,10-29-2020,"Experience with data analytics tools including Python, R, etc.
Stefanini is looking for a Senior Data Engineer to support Open Source and Commercial-off-the…",,https://www.indeed.com/rc/clk?jk=82aa1814d5333334&fccid=7e646b8cb4a11b13&vjs=3
Data Engineer,Internet of Things LLC,"Richmond, VA",8 days ago,10-29-2020,"A data engineer to work on a big-data project to gather and process cyber datasets across over 900 AWS accounts.
At least 5 years total experience.",$60.00 - $62.56 an hour,https://www.indeed.com/company/Internet-of-Things-LLC/jobs/Data-Engineer-be2cab17dc8f039b?fccid=b58fbf7d04988fe3&vjs=3
Data Engineer,iconvergence,Remote,8 days ago,10-29-2020,Devices Engineering Services team is building enterprise scale data processing and management solution to utilize the hardware development engineering data for…,"$87,378 - $196,440 a year",https://www.indeed.com/company/iConvergenceSolutions/jobs/Data-Engineer-d3774165172accc8?fccid=8048f09ea2d1f72f&vjs=3
Data Scientist,"Avicena, LLC",Remote,10 days ago,10-29-2020,"Collaborate tightly with a team of software engineers, signal processing engineers, and other data scientists to generate diagnostic models based on clinical…","$120,000 - $150,000 a year",https://www.indeed.com/pagead/clk?mo=r&ad=-6NYlbfkN0AuXf0EN8e87Uf36saLlM8utKq6KkY-lyQETqCLe6Q0NUUQIXRsKpw1qJfMD5-egfPs4_arfePQOeQp_U0tukmf2aN-fB9zyGSBqoMwUq0TwevpeuE3oSKgS2_A3odjJh4Tzd9B3VVSwTFkiyJ6mvJ0xLeOSLlXKbFXUq7L5_2e9K3LsfNEZs-iWbm6-PdXWAKQNixpIOFh7CgyHHyOUBu6jdaxme08rOnnSoUYyFZhrKSJ2lUCkhktdgzMk63gZALei3-MiBCNsXPy5XW_qrDLxT-4c7NPnlQfmPHO2XCFmUp98ojTlisP2pK3mMWK-rbqpeNF0GS2T0gxYRX1PtV9VhOrph88nT9NrK7JoVKUSzVK-ybbgAGFw4DRHO9T3DKR8W2LqBrKSbg0eA-LuarZfPdWP8ibcIK5PVZ-jjA3yIo-XUyVWH_JcGSamWdMpCo=&p=11&fvj=1&vjs=3
"Data Engineer, Data Intelligence",Indigo,Massachusetts,1 day ago,10-29-2020,"Collaborate with researchers and data scientists to ensure understanding data and data needs.
Strong desire to work on data cleaning, processes and execution to…",,https://www.indeed.com/rc/clk?jk=67163b4c4c0a64d4&fccid=27b70883756a2db2&vjs=3
Data Platform Engineer,Pantheon,United States,Just posted,10-29-2020,"Experience supporting data scientists and analysts through PaaS.
Create an automated, state of the art, data platform for various job types and sizes.",,https://www.indeed.com/rc/clk?jk=b13eb1efb03b1e99&fccid=dd616958bd9ddc12&vjs=3
Data Engineer II,Medical University of South Carolina,"Charleston, SC",3 days ago,10-29-2020,"Under indirect supervision, the Data Engineer II provides a variety of operational, technical and collaborative functions within the data Management function of…",,https://www.indeed.com/rc/clk?jk=2d013b4c722da2cf&fccid=a0cb52b0fb3555b4&vjs=3
Database Engineer,Medisolv Inc,"Columbia, MD",8 days ago,10-29-2020,"Healthcare data and data standards (Standard code systems, quality reporting, etc.).
Experience performing data analysis and calculations within a database…",,https://www.indeed.com/pagead/clk?mo=r&ad=-6NYlbfkN0ByjEOJNPME_-JPGrq604UpliuNXNmcl20-hP1wuNGXDPj_sIsj0ykSrAIklVbkIGgpgs5ot-_7yRneO8fQH4gjAByfmrwa2nIBrxnd6nO8jvlnryoylYo4Ww-skI24PGtw8tdKhuCdQTMwEDcZuBMSr9kOmYFDyNB2bCCgnfxxOt1G4IKxgp9Gob0Fcnu9ld07HHfDXtERddLcKj0KpvfYLFFU6n3pboo4gCLJeI-lGaz2vfHXVFiOwKiqOPkxSPGGsfkhoSbxXAIzA3xhA0LG97Zi3Yni9oVHXz8kabAVXCEcSt9BNLA-KQpF3zEdWkNfZwsB8oqhGjJxzY8k9mHp_R_Hs7nIGPKHU53rsqlrvCfLH8Wz1mepI2qZUI0LCNigzT9gr2BV5xBV0Atb9Epa9Iw32PX_S-DLIhLAw_-HgiKCm7Xu9OqGeADru3lo5F4ldP4toYoRo5dVEthLxvK0&p=0&fvj=0&vjs=3
Data Engineer,RiskIQ,California,Today,10-29-2020,"Prior experience developing data pipelines for data sets above 1 TB.
Maintaining the high-quality of our data pipelines in production, ensuring that the data…",,https://www.indeed.com/rc/clk?jk=d90ad300ee39cc4c&fccid=fcbd02e4c90e5fbb&vjs=3
Data Engineer,iconvergence,Remote,8 days ago,10-29-2020,Devices Engineering Services team is building enterprise scale data processing and management solution to utilize the hardware development engineering data for…,"$87,378 - $196,440 a year",https://www.indeed.com/company/iConvergenceSolutions/jobs/Data-Engineer-d3774165172accc8?fccid=8048f09ea2d1f72f&vjs=3
Data Engineer,Dandy,"New York, NY",2 days ago,10-29-2020,"1-5+ years in a data engineer or SQL-heavy data analyst role (high-growth startup environments highly preferred).
Dandy is a business-in-a-box for dentists.",,https://www.indeed.com/rc/clk?jk=bcee578b72a89f21&fccid=122a2a18f7a5d394&vjs=3
Data Engineer,Maven LLC,"Columbus, OH",9 days ago,10-29-2020,"Experience in a health system, health plan or healthcare-data startup as a data analyst.
Experience with health care claims data.",,https://www.indeed.com/rc/clk?jk=6e62f52eb0a04747&fccid=8af0bc8594ed7b52&vjs=3
Data Engineer(Advanced Analytics),Blue5Green LLC,"Wyomissing, PA",Today,10-29-2020,Required skills (maximum of 6): Data engineer with experience of data warehousing and analytics landscape technologiesGood experience of SQL programmingBasic…,,https://www.indeed.com/rc/clk?jk=a85febb9c5eb63a3&fccid=fc72439a5d407f8c&vjs=3
Data Engineer – Personalization,Spotify,"Boston, MA",2 days ago,10-29-2020,"You are knowledgeable about data modeling, data access, and data storage techniques.
Build large-scale batch and real-time data pipelines with data processing…",,https://www.indeed.com/rc/clk?jk=c244ec09b964443b&fccid=fe404d18bb9eef1e&vjs=3
Senior Data warehouse Engineer,Hanatek LLC,"San Ramon, CA",8 days ago,10-29-2020,"Perform data profiling on large, complex data sets and provide insights into data quality challenges.
Build, maintain, and improve data models, dashboards, and…",$70 - $95 an hour,https://www.indeed.com/company/Hanatek-LLC/jobs/Senior-Data-Warehouse-Engineer-96058425050c6e61?fccid=86c34378d3d181da&vjs=3
Data Engineer - Community,Twitch,"San Francisco, CA",2 days ago,10-29-2020,"Experience building aggregates, optimizing data workstreams and maintaining data pipelines.
Partner with the Central Data Platform & Analytics teams to…",,https://www.indeed.com/rc/clk?jk=b43c8b04cbf6c619&fccid=e21f6affbb4bb0b2&vjs=3
Data Engineer,OverlayAnalytics,"Dallas, TX",7 days ago,10-29-2020,"Navigate new data sets frequently and model data efficiently and effectively.
Experience in developing and maintaining ETL/ELT data pipelines.",,https://www.indeed.com/rc/clk?jk=c9228a03cff9c6d2&fccid=e530731ee79de0b9&vjs=3
Data Scientist / Engineer,Harvard University,"Boston, MA",9 days ago,10-29-2020,"00 - Non Union, Exempt or Temporary.
35 hrs. per week | Monday - Friday | 9:00 am - 5:00 pm.",,https://www.indeed.com/rc/clk?jk=f51201ad681b4071&fccid=5507a64404691526&vjs=3
Data Analytics Engineer,Synergy Systems,"Nashville, TN",1 day ago,10-29-2020,"Strong competency with SQL dialects on distributed or data lake style systems (Presto, BigQuery, Spark/Hive SQL, etc), including SQL based experience in nested…","$85,000 - $125,000 a year",https://www.indeed.com/company/Synergy-Systems/jobs/Data-Analytic-Engineer-cc0677a40e292cf7?fccid=e143f1b08f6269c3&vjs=3
Data Engineer Intern,Warner Bros. Entertainment Group,"Needham, MA",7 days ago,10-29-2020,"Learn the internals of building a robust end-to-end data pipeline on all levels especially in databases, data modelling, data processing infrastructure and…",,https://www.indeed.com/rc/clk?jk=c9b4ad5a891de29b&fccid=30cc7a5451d4ee77&vjs=3
Data Reporting Engineer,Pricesenz,"Denver, CO",1 day ago,10-29-2020,"Strong Expertise in Data Mining and Data Analytics in a complex environment, and experience in creating transformed reporting structures,.","From $90,000 a year",https://www.indeed.com/company/PriceSenz/jobs/Data-Reporting-Engineer-eb9615848139aecf?fccid=04f1a341eb475915&vjs=3
