Title,Company,Location,PostDate,ExtractDate,Summary,Salary,JobUrl
Solutions Engineer,Segment,California,Just posted,10-29-2020,"Develop subject matter expertise on the customer data landscape, and Segment's role within the customer data ecosystem.",,https://www.indeed.com/rc/clk?jk=627ec0928c404ff2&fccid=1ed502f6da51dc36&vjs=3
"Associate Creative Director - Video Ads (Fully Remote, Work from Home)",Metabolic Living,Remote,5 days ago,10-29-2020,Data-Driven – Extremely comfortable flexing the analytical side of your brain with a passion for reviewing performance data to gain creative insights.,"$85,000 - $115,000 a year",https://www.indeed.com/pagead/clk?mo=r&ad=-6NYlbfkN0B_MNPxj3wIboM-Pg3aIyhDQ0fnGYn4NhsByRbzZWqUuOnNPFjLiWbvXQO0J8qR5J502zCy_ki8rnsW_AA14St8VXi2GP-o2qwh9q_fwvQP4UFSok6SGtIIK9CGY0CJTos1QCMTI5ZlquITxGJIkW4L86iXQQ0EbRws6U0mJtbiDG-iUHEZy406V2y8z5l-l0UdsjtqGy1ZBnSrn7mIzUoJDLVYgV1OESNqxMYku6xSUpT-U-TjBd5QW8WNM6D_5A47CkOkLfDgf1aO4TvhLq4W9AOYXSDV8MxFUxuSPiSNLcF-l_GqpoaxsMjxPFt9hKW7O_mKuj2oFnMLDPGTSo1agoK62IzT04oreO6e73nGNRmbi_AWtBRq7nW59kJqzgvD-ubQIIpJOXUECGJEh525oTzsF6cZb7HFo4mtQNtbig==&p=9&fvj=0&vjs=3
Data Platform Engineer,IDENTIFY SECURITY,United States,9 days ago,10-29-2020,"Experience on data warehouse/data lake projects.
4+ years of data engineering, schema design, dimensional data modeling, and/or data management experience.",,https://www.indeed.com/rc/clk?jk=13a2a79a5679117c&fccid=0e92fabdd1a14c59&vjs=3
Sr ETL Engineer,DigiCert,"Lehi, UT",1 day ago,10-29-2020,"Make continuous improvements to the data warehouse architecture to support DigiCert's growing data needs.
Experience detecting and addressing issues in data and…",,https://www.indeed.com/rc/clk?jk=d1ee09a9d79f2b2d&fccid=a9e65846c0a6c220&vjs=3
R&D Informatics & Data Engineer,Frontier Medicines,"South San Francisco, CA",6 days ago,10-29-2020,"Work closely with key stakeholders to design, implement and support research informatic solutions directed towards the capture, processing, analysis and…",,https://www.indeed.com/company/Frontier-Medicines/jobs/R&D-Informatic-Data-Engineer-5b5af7c230f4dcec?fccid=7b6799f3817f372b&vjs=3
Desktop Engineer (APAC),BlockFi,United States,13 days ago,10-29-2020,Knowledge of best practices around data security and providing guidance to our users that encourages safe collaboration at BlockFi.,,https://www.indeed.com/rc/clk?jk=e78b7b954454cc61&fccid=d26901b7a9b35c6c&vjs=3
Software Engineer (ITSE06) REF DATA INSTRUMENT NY (435306:US:0802),"JPMorgan Chase Bank, N.A.","Houston, TX",Just posted,10-29-2020,"Perform analytics on past data, such as incidents and usage patterns for predicting issues and take proactive steps to implement improvements.",,https://www.indeed.com/rc/clk?jk=520fd6f4566bc0de&fccid=aaf3b433897ea465&vjs=3
Senior Data Engineer,Progressive IT,"McKinney, TX",7 days ago,10-29-2020,"The data engineer will be handling the design and construction of scalable data management systems, ensure that all data systems meet company requirements, and…",,https://www.indeed.com/pagead/clk?mo=r&ad=-6NYlbfkN0Cy7Od_y0M8ZhqDgWHqI0USuJAjTvWZLWS1aAu4pUc1rEcG0_XGczRA_tOrSrHN2lnqmXAClfESpOitgNC5Nyd050hNo2pAvrwmH2xEeVTRCIpbJce4_GCl6DAE4XnKRj6iJrVibKV0qELWpRf98kb2G2YXw_2Scox-VkzQ3O8O1F3Qa1PE6P70Gr7GQabWDPFVhqiHWJdVhFEPYyYL7Irk0zGXKQ3ImEkO9cW5ix3uguj9L0YCxzTIylSmEf8Vvlh-DiuiAF7p03F9SlIs2altF8UD3zF1Q4N7_2eRTxV034GKYJzYOWjgQAz0J5RR1lHqvj7dCH3WnUiJPYSwTRV-_wy0-6_4M715DRd2YN54BZOacTNzeLNv6jVl63uuKl2RkUnQ86t5hq0Anxm6ic-yixnpghvvZyrvRmuyMfI51_lTnT1TwEB03YZfAqvwPoDK6QObhbmHxbuk7oKZXGa_MSXqFemBhIzrZ9PydXYsqEH-29IYwR1SRSxCQqPOjA3F0Vw67Psh91fDHpIC7TcBN3-uDO16wwG-N-TccbHzQhJhqqB9vW4r_eRnEMI2ffViv8Yxz_-hLMNzelCZhPoPD9gIKCIUQ8nvhnL-ZpKheg==&p=0&fvj=0&vjs=3
R&D Informatics & Data Engineer,Frontier Medicines,"South San Francisco, CA",6 days ago,10-29-2020,"Work closely with key stakeholders to design, implement and support research informatic solutions directed towards the capture, processing, analysis and…",,https://www.indeed.com/pagead/clk?mo=r&ad=-6NYlbfkN0BU9GAifL07WuH5XdCXMHHfSyO26SC6Fc_5Q8nQ8Tx2JLXMHb7j5izbY18yJBn15E7ozrzRyk0LiFRSIYPIxfHLO_CHJV48AMgNrd_QkriLS3aVKkOjKuMepsu7pw_FVFY3tvixI95jGOB_o738WwesQxirrJkNKcat25D5M_tdE2qXzS-ODPRiDxEQtKlPYN3MRz9rpCXNht9AMmSZU5hF8iHOCsxvmkp7l1ylNxRenVkmvTVBFte57itO-XZXquWpLzyRA7VT34qPRnXcjv7i9emzgxPJioZgLEs1xRnv6J2S0sMjInu1R4WRqL5hkubR7K3B8Cx46Fv5i-x7w4gzIux6jbkkjwLF-jPvgY0No6JVagj3wNIPdYCKMdt6RIyUXHpsXcrVY3-ihSFrUBqphwEGyHv0TFu3VbuZ4vHTSUH5YTpk8ecpPfwjBxxGHS0uUOSmWLZpPWYkS4tFerVv3jhYyaclVsg=&p=1&fvj=1&vjs=3
Data Engineer- remote 6-month contract,Envision LLC,"St. Louis, MO",1 day ago,10-29-2020,"Someone who has experience extracting data from machine generate data.
Designing and developing ETL data pipeline – Data pipeline and building data pipeline’s…",,https://www.indeed.com/pagead/clk?mo=r&ad=-6NYlbfkN0A13XXEAKoVsy1UjAxA2tJa37vkRdGHJdX4gYp8IY3tTpc57ra18Z9sYJ3trAbN1b1F1rQlfr5UrBUpw74g9BjdvMMGgvalZPDwELZNdI1xC1S354U_-3DQsdBftLzF1iC5Lv9HKFl8aoJWB9kpvQ4xCzHOz-B6BuFpABSLvyVD-NnVO-s9vr-JnkVla9AOVc_DiaNOvXH7b43p912KeqmM7PPzsM0e8aaU-FW5te3_3I7d2FvFY_wbo6kYA5t7GiEGxNEwlXkCa2BTwtP_OfL2y-ENqrPbq-Ib35Mq1BCmGuuhw1vVaXYcl0yj0aXCgyzrRrSOI1l33TPUUND4607q6vQvrVOqsHS3TKG64RYLpILq5puzLmaIVfZhKekcALTXIYqDT067ihxSoX8Nn54ZJvFaQnD3Gl-OQYVl4R2J9LiqqVGr-sW1NKQ_lLvXp2sAFu7z5hjKRQ==&p=2&fvj=0&vjs=3
React Engineer,Kunai Consulting,Remote,1 day ago,10-29-2020,"Experience with data structure libraries (e.g., Immutable.js).
Compile and analyze data, processes, and code to troubleshoot problems and identify areas for…",,https://www.indeed.com/rc/clk?jk=56485056435595ef&fccid=915002cec1e55486&vjs=3
Data Visualization Engineer,"Amick Brown, LLC","Norcross, GA",8 days ago,10-29-2020,You will build dashboards and applications to track pipeline performance and data processes alongside our software and data engineers.,,https://www.indeed.com/rc/clk?jk=265dfb2c0b5eeca4&fccid=eedf72ea6f271445&vjs=3
Data Integration Engineer,Cetera Financial Group,United States,Today,10-29-2020,"Sound understanding of data warehouse best practices, relational data structures and dimensional data modeling is required along with strong SQL skills.",,https://www.indeed.com/rc/clk?jk=acf47d98250d6a15&fccid=32dda9721fdfaba8&vjs=3
Sr. Automation Engineer- Big Data,GroupA,"Pleasanton, CA",6 days ago,10-29-2020,"Knowledge of big data analytics.
Data ETL querying and reporting: 4 years (Required).
Experience in Python, Build pipelines, Automation, and Big data Analytics.",$70 an hour,https://www.indeed.com/company/GroupA/jobs/Senior-Automation-Engineer-b378e058ca6c2eb9?fccid=0e327cc7efe72d8f&vjs=3
Data Scientist,"Avicena, LLC",Remote,10 days ago,10-29-2020,"Collaborate tightly with a team of software engineers, signal processing engineers, and other data scientists to generate diagnostic models based on clinical…","$120,000 - $150,000 a year","https://www.indeed.com/company/Avicena,-LLC/jobs/Data-Scientist-6c59fa987e480e20?fccid=d820b5381c2558ed&vjs=3"
Sr. Data Scientist/Machine Learning Engineer,AptoNet Inc,"Atlanta, GA",2 days ago,10-29-2020,"Evaluate accuracy and quality of data sources, as well as the designed models.
We work with various product teams across various business units to define high…",$55 - $75 an hour,https://www.indeed.com/company/Aptonet-Inc./jobs/Senior-Data-Scientist-Machine-Learning-Engineer-beb3558620e5257a?fccid=6fc7836bc22ff415&vjs=3
Data Center Engineer,Applied Insight,"Arnold, MO",13 days ago,10-29-2020,"Recognizes potential, successful, and unsuccessful intrusion attempts and compromises thorough reviews and analyses of relevant event detail and summary…",,https://www.indeed.com/rc/clk?jk=98555a48f4f41909&fccid=abe7b6801524c7e0&vjs=3
Data Engineer,Sweetwater Sound,"Fort Wayne, IN",14 days ago,10-29-2020,"Develop standards for Data Governance, data lifecycle, master data management and data cataloging.
The Data Engineer will support our software developers,…",,https://www.indeed.com/rc/clk?jk=77936a33834b34f9&fccid=762714647f0cebb8&vjs=3
"Software Engineer (Backend APIs, Data Engineering) - Duo Security",Cisco Systems,"Austin, TX",Just posted,10-29-2020,"Partner with data engineers and data scientists to deliver machine learning product features to millions of users across 21,000+ Duo customers.",,https://www.indeed.com/rc/clk?jk=0e4946babc1cdadb&fccid=dfc44f3b8c44a6db&vjs=3
"Data Engineer, Web Personalization",Spokeo,"Pasadena, CA",7 days ago,10-29-2020,"Strong foundation in object-oriented programming, algorithms, and data structures.
You'll use Spokeo’s customer data platform to build analytics-driven product…",,https://www.indeed.com/rc/clk?jk=b7abc7f396c7b2f6&fccid=8f3c0373bcfa5520&vjs=3
Business Intelligence Data Engineer,Golden State Foods,"Irvine, CA",14 days ago,10-29-2020,"Provide application analysis and data modeling design to collect data for centralized data warehouse.
Map source system data to data warehouse tables.",,https://www.indeed.com/pagead/clk?mo=r&ad=-6NYlbfkN0AbRDI-lGFs5QlqkohoUB2e5sgCs9HeEJ9hgGj-UwEHEp6HU_wDtQH-DctAHXoIBBURi2bymK4Y27QbYvWtXiEiDWi44xXKOyQ46pBE_CTCeWXG2gZDuByA9p-d1lxLoK_Vqk0G1RPuYiqs8ZY33sIm4buAabCv7BodlzvEQOYMi01Z-RYc0SRnd1zMjMKdNNAfpiJpnuSNXaDTd3-3Er6OxvPjb8xvy55LcqRf6Z3deqiSCnXtNAeZPTDqlrmlG5nzBTXrkPdm4ob5m5xCNEoTXMtHM_ZV4OfAeFIfxvQJxtb3SnejStRrd1ygpw7ElB_3BLivasadr9_5CsTGt6vx1bRHxslOpoqFbgIt35grIf2JBhN01YPYoeQGiQbBthlw78G9gBr_oe9sMHV8fwyQuHQflCCaRYTQ0BoXjBz6AimDDSjum7R0KA620juw8fmVWcR4XaV2SG5MQd4QAPHTx4E_gBOyoxWEoo5Md_4Qtw==&p=13&fvj=1&vjs=3
Data Engineer,Itility,"San Diego, CA",8 days ago,10-29-2020,"As Hadoop data engineer, you are responsible for the functional part of provisioning data - eg building data inserted pipelines and data connectors.","$80,000 - $125,000 a year",https://www.indeed.com/pagead/clk?mo=r&ad=-6NYlbfkN0CHMQdqSgwEG8kiMfPxdvpQEyd6VhWmdX3N1gBfyFHBJtVvgJvpm7HvHrjtCPT_OD71X1gY5yOAKTMF4dP6PXGabc0ghyCplinY-NIg3MWHm6My0FmspfGmqkQPYx61RMPQKhFSW_xd20QsxQ1rxd4w4ak2XtNFCywO64PtokIz5aIJTxyaALyAfPD9Ho--TPelxJ5Nqerd1KM7rzsnnPlGOx0F3Az6si0V7OIJbP9aAcyGbHN3hfj3ziORpfn_Y87e13KBe_uM1s92pYeHd_4LbhWXPD3iiNhjEBCJA-T3-RFcjdiLzFKc0q3f9Hi4m3dS0CVuIyjgO64Rvrpf8-JIgDX6nlsq2RuX4RTd0oN0BzQfd3dKHlri2YTG_zISvsTsU7fnhv0WATgJB_R5KwpNtK8AgejhmHaGZgivs09VHFyymH7Ek6zWFlkY4QUgSI-GF1EWBtDDaQ==&p=14&fvj=1&vjs=3
Senior Data Engineer,Microsoft,"Bellevue, WA",2 days ago,10-29-2020,"Experience delivering data solutions via Agile methodologies.
For this senior engineer position, the ideal candidate will have ample experience delivering data…",,https://www.indeed.com/rc/clk?jk=435bb12551b4fa43&fccid=734cb5a01ee60f80&vjs=3
Part-Time Database Engineer,"University of Maryland, Baltimore","Baltimore, MD",3 days ago,10-29-2020,"Monitor, analyze, and verify data to ensure data integrity.
Develop and document data models.
Conduct file maintenance and maintain the data dictionary.",,https://www.indeed.com/rc/clk?jk=c6410029bc1ba3e6&fccid=9eb13995e57c07c3&vjs=3
Sr Cloud Engineer - 7900,ProFocus,"Beaverton, OR",2 days ago,10-29-2020,"Experience provisioning RESTful API’s to enable real-time data consumption.
PAY: Target pay for this role is $75 - $85 per hour and varies based on experience.",$75 - $85 an hour,https://www.indeed.com/rc/clk?jk=81c5102aba278ad9&fccid=0c4cb88efa29d448&vjs=3
Principal Data Engineer,"VIZIO, Inc.","Denver, CO",6 days ago,10-29-2020,"As part of this you will be doing a deep dive into all things data-related including but not limited to: how data is structured, how if flows through the system…",,https://www.indeed.com/rc/clk?jk=a9003000b2d2eea0&fccid=2ac0dbed95f0e3bf&vjs=3
Data Center Technician,"UPPER, LLC","Arlington, TN",6 days ago,10-29-2020,"UPPER holds a database of qualifying Engineers.
Data Center: 1 year (Preferred).",$30 - $40 an hour,"https://www.indeed.com/company/UPPER,-LLC/jobs/Data-Center-Technician-5780329ca1d8691b?fccid=ce1301670fc29522&vjs=3"
Network Data Architecture Engineer,Central Business Solutions Inc,"Milpitas, CA",13 days ago,10-29-2020,"They will need to be well versed in Palo Alto, Nexus, BGP, EBGP, OSPF, QoS, DMvpn, VPN, all facets of routing & switching, Layer 1, 2, and 3 topology and hand…",$70 - $72 an hour,https://www.indeed.com/company/Central-Business-Solutions-Inc/jobs/Network-Data-Architecture-Engineer-c319fdf6c6e3cfea?fccid=6e7c7a8560e5e90e&vjs=3
Lab Engineer,Beyondsoft Consulting,"Redmond, WA",Today,10-29-2020,"On-site to the lab and stand by for tickets.
Hardware modification, e.g. install/remove parts on the server.
FPGA/FW Mass Programming (training will be provided…",,https://www.indeed.com/rc/clk?jk=5432e5b451f10c48&fccid=ee3ef3b98a9e5bcb&vjs=3
Jr. Software Engineer,UHIN,"Salt Lake City, UT",2 days ago,10-29-2020,"Code: An engineer with experience in backend or frontend technology (PHP, C#, .
Personal computer including; email, internet, word processing, spreadsheet and…","$63,000 - $87,000 a year",https://www.indeed.com/company/Utah-Health-Information-Network/jobs/Junior-Software-Engineer-3118e77e35109a9c?fccid=437b33a1bbba17d6&vjs=3
"Software Engineer, Junior",Booz Allen Hamilton,"New York, NY",13 days ago,10-29-2020,"You know you need the right combination of clean code, APIs, analytics, and infrastructure to build a user focused solution.",,https://www.indeed.com/rc/clk?jk=421b5cd0874347dd&fccid=4e041af1d0af1bc8&vjs=3
Data Analytics Engineer - TechOps (Remote),CrowdStrike,"Sunnyvale, CA",10 days ago,10-29-2020,"Knowledge of Tableau and other big data analysis and visualization tools.
Monitor and generate reports associated with changes in data center and public cloud…",,https://www.indeed.com/pagead/clk?mo=r&ad=-6NYlbfkN0CldWFoyDpkHnJTQSfVUE5RQFl3HAg1b-P_XkmmEIK7lCwlsAs6uQM2QF4tYuDNI98hD6DW1WPB5Ym19INDz8X7vzUGtyZ3bm0gV2m1ib8A9CRfrzcNfE4i6IVpLLbDk07deeizUp-nD27fDdPjS7Mb8XoxqfvjgvGDefeXf0CeNbnXEui0OkjRoXHzDWVwOr2Jcj3vZIwgTpftm7X36wpKmX4XTYOqBKDEV37QCIjQQthhlsAEz8t5QZqtSCwefwuF176Um83zIJDyWz7r19YCz-a8RbefYfrq0iQquA1PdoNv2f9O5B3syU2NYLCgVqqun5rKOylUKzJjCRHvwAEtFUEYp78PA6Xutc42gdrb2OQvOzl_wQwvKPaSxeyYajRhH3sAGr7hvg==&p=9&fvj=0&vjs=3
Senior Data Analyst,Benefits Data Trust,"Philadelphia, PA",Just posted,10-29-2020,"Support the development of company-wide data standards and practices to enhance analytical rigor, validate data, and enhance data literacy.",,https://www.indeed.com/rc/clk?jk=1d1e14aeb8a54dbd&fccid=8273096142d72280&vjs=3
Full-time Development Opportunities - KubeCon 2020,Apple,"Santa Clara Valley, CA",1 day ago,10-29-2020,"Apple engineers have always focused on one person when they build software — the person who will use it.
BS/MS/PhD in Computer Science, Electrical Engineering,…",,https://www.indeed.com/rc/clk?jk=667eb3b343873831&fccid=c1099851e9794854&vjs=3
"AI/ML - Realtime Domains Backend Engineer, Information Intelligence",Apple,"Seattle, WA",2 days ago,10-29-2020,"Experience with data transformation pipelines.
You will be responsible for the entire backend stack, from data ingestion and processing to query performance and…",,https://www.indeed.com/rc/clk?jk=95d2d535ea249246&fccid=c1099851e9794854&vjs=3
Software Engineer (Backend),RStudio,United States,2 days ago,10-29-2020,"In this position, you will be a member of a cross-functional team working daily with developers of various stripes, QA engineers, product managers, and site…",,https://www.indeed.com/rc/clk?jk=cd25c69be7003294&fccid=51b16288e36313e8&vjs=3
Software Engineer,Kharon,"Los Angeles, CA",Today,10-29-2020,"4+ years experience as a professional software engineer.
Integrate and produce data tracking and event metrics.
Integrate and extend security components.",,https://www.indeed.com/rc/clk?jk=c5162114ad065873&fccid=b544304db34cd3c6&vjs=3
Engineer I,State of Delaware,"New Castle, DE",2 days ago,10-29-2020,"Plans and conducts field studies, surveys, research and development projects, inspections and/or investigations to collect data and ensure conformance to state…",,https://www.indeed.com/rc/clk?jk=deee47da4d095e4c&fccid=b60a20ee4d674165&vjs=3
Full Stack Engineer Intern,EigenPatterns Inc.,Remote,Just posted,10-29-2020,"Create scalable services that can receive thousands of calls in parallel, with input data.
Integration with Spark cluster to process streaming data and execute…",,https://www.indeed.com/company/EigenPatterns-Inc./jobs/Full-Stack-Engineer-Intern-da88166dfcab0a56?fccid=268dcabab0895d98&vjs=3
Software Engineer Intern,Intel,"Phoenix, AZ",Today,10-29-2020,"Working at these problems requires solving many technical challenges in the areas of file system, data storage, database, distributed computing, data analytics,…",,https://www.indeed.com/rc/clk?jk=8c8a64a7d76eb0b9&fccid=f1374be6a45f4b8a&vjs=3
Early Career Test Engineer,Blue Origin,"Kent, WA",5 days ago,10-29-2020,"Operate test consoles and work with a team of engineers & technicians to execute component level testing.
In this hands-on position you’ll work directly with a…",,https://www.indeed.com/rc/clk?jk=ed817768b5111636&fccid=0f97f3c514b55d0d&vjs=3
"Sr. Data Engineer, Analytics","Take-Two Interactive Software, Inc.","New York, NY",3 days ago,10-29-2020,"Develop data quality framework to provide transparency into data quality across systems (timeliness, accuracy, completeness, etc.).",,https://www.indeed.com/rc/clk?jk=cfdc74fb468015ae&fccid=2dda8667d8de78d8&vjs=3
Sr. Data Engineer,"Trobus Technologies,LLC",Remote,6 days ago,10-29-2020,"Gathering data requirements from stakeholders.
Evaluating data collection for accuracy.
Familiar with the modern cloud data platforms (Azure preferred but AWS…","$125,000 a year","https://www.indeed.com/company/Trobus-Technologies,LLC/jobs/Senior-Data-Engineer-4368b390e4c54a85?fccid=a16f15618775fd03&vjs=3"
Software Engineer (Backend Focus),Quick Base,"Cambridge, MA",12 days ago,10-29-2020,"You will work with other developers, Product Management and User Experience Designers to create solutions that allow our customers to have safety and security…",,https://www.indeed.com/rc/clk?jk=8804d7086c02ddf2&fccid=9b19e29b4e8af80d&vjs=3
QA Engineer,CoStar Group,"Washington, DC",7 days ago,10-29-2020,"3+ years experience as a software quality assurance engineer.
CoStar delivers real-time, verified commercial real estate data that helps clients confidently…",,https://www.indeed.com/rc/clk?jk=96eceff09e1d3694&fccid=644000bf52ae09d4&vjs=3
Sr. Data Engineer,nThrive,"Layton, UT",8 days ago,10-29-2020,Utilize your expert knowledge of SQL and transactional data stores to engineer and administer data pipelines between our data warehouse and application layer.,,https://www.indeed.com/rc/clk?jk=da4afe22b81dea99&fccid=6adfe00d346f10b0&vjs=3
Site Reliability Engineer II,Indeed,Remote,3 days ago,10-29-2020,"Experience in data structures, algorithms, and software design.
Other rewards may include quarterly bonuses, Long Term Incentives, an open Paid Time Off policy,…","$116,000 - $142,000 a year",https://www.indeed.com/rc/clk?jk=5f9c42670d8efc0f&fccid=d6ef41e202aa2c0b&vjs=3
Senior Data Engineer,Rinchem Company Inc.,"Albuquerque, NM",7 days ago,10-29-2020,"Minimum of 10 years of experience as a data engineer or data architect.
Experience with both normalized and dimensional data models, structured and unstructured…",,https://www.indeed.com/company/Rinchem-Company-Inc./jobs/Senior-Data-Engineer-9b56bcb7800932ea?fccid=a23ebe764cb38d2a&vjs=3
Cloud/Data Engineer,"Nasdaq, Inc.","New York, NY",6 days ago,10-29-2020,"Experience with master data management, data governance, data security, data quality and related tools desired.
Strong data analysis and troubleshooting skills.",,https://www.indeed.com/rc/clk?jk=3a1fae77ad368e29&fccid=dfb4fdb54d19e21c&vjs=3
Data Integrations Specialist,Convey,Texas,Today,10-29-2020,"3+ years of experience implementing complex data integrations with enterprise customers.
Experience working with APIs and various data formats, including…",,https://www.indeed.com/rc/clk?jk=875326f320011451&fccid=fa6f154812a88990&vjs=3
Sr Big Data/Data Engineer,Inceed,"Houston, TX",1 day ago,10-29-2020,"This person will be responsible for leading the design, development and implementation of application systems to meet business needs.",$55 - $75 an hour,https://www.indeed.com/pagead/clk?mo=r&ad=-6NYlbfkN0AoBNnhwaemRAOYHpUmcUH3kMsCSpKBJJRmoHC-YTpRnKon-9Q9ccBxA2-HqZ5NGjN0Wd2PP-fQpf-nSRIaN3-3o2yzMSX_5Cw-b3UQRITsZyHmihPHeHHtRhJYqgx8Bm3mzHrUhfyz3NjB_4ROVHCohsnUem3PZqWd8fYnv42UvR1ScTCz4RPPOSVwdt9BPhdQlSA9tJSlZD8CqgLNo6qrJaqlzabjos7_DN4GuNMieh1WyIJ0zMRq3j5LrOa0OI-YNakdvZR3p7tocEahnNICuHCCTd_4qDDm02PyCNx1s8aVfzIgVUjc3s2guQDqaEflWmaACobvS_v4Z-2kMnAI3dkbUuklQntcMNDQEl-Mr_ba_8s7kjoIDm1ucu0LSGc_5rBGqCEnxc6C24CQp3n95UQdUJcjpct_yk1-eGrAAXwCnHMvqosBwydj8EKmY2QiUiPVHGHl17GNcpJbaDjWiX4_ogTeolA=&p=13&fvj=1&vjs=3
"DevOps Engineer, Junior",Booz Allen Hamilton,"Lexington, MA",2 days ago,10-29-2020,"Experience with using scripting languages, including Bash, Python, Batch, or PowerShell to automate tasks and manipulate data.",,https://www.indeed.com/rc/clk?jk=cc8158e6f165502f&fccid=4e041af1d0af1bc8&vjs=3
Business Intelligence Data Engineer,Golden State Foods,"Irvine, CA",14 days ago,10-29-2020,"Provide application analysis and data modeling design to collect data for centralized data warehouse.
Map source system data to data warehouse tables.",,https://www.indeed.com/pagead/clk?mo=r&ad=-6NYlbfkN0AbRDI-lGFs5QlqkohoUB2e5sgCs9HeEJ9hgGj-UwEHEp6HU_wDtQH-DctAHXoIBBURi2bymK4Y27QbYvWtXiEiDWi44xXKOyQ46pBE_CTCeWXG2gZDuByA9p-d1lxLoK_Vqk0G1RPuYiqs8ZY33sIm4buAabCv7BodlzvEQOYMi01Z-RYc0SRn1diurL34Djj-j7ko_ZzzZ9aPJyhAAxNCLvZfDUdCvcohuuo9qtHZdmgVy-2jHoMy6i68iw_7hCQbWUfK94xC0d-UEtRbdIOoFqyutLWnBXiAAUqRWRy3Vf7JK5XNgDVtl9MOujhgHurbRdZu6SjklwyyW6SZpJ3y-JpO86kbA4dhRsjUsCZ8q2XxL9UbRckPCzLaLAfTxeNofpmU4b4n6xPZHh4sV-c_Lr4bnW0VEIHdE83md81Hk8mYjPuw2cLVrmxCLZ_90Beeek_ZJ5_dCrzqZ5exdiT2fDtXeZxznUtnCMhR66cKAA==&p=0&fvj=1&vjs=3
Data Engineer,JONDO,"Yorba Linda, CA",6 days ago,10-29-2020,"Some experience working with batch data, especially Facebook data, Google Analytics data, or any shipping carrier and payment system data.","$70,000 - $90,000 a year",https://www.indeed.com/pagead/clk?mo=r&ad=-6NYlbfkN0DV_TdDxrYPaTDvkiuz_Y8pxbdDODa2wCuSej1y-Wbu4PYd-dGGF4dMg2z5re39qwa6lXoFfUGQmMvaHDMOXczQ8YioJdau3aiNzu3536mweeYHB8fHB5atFHYiTrwrxRGNOu6IUr1u8RjBnaAAvaoltPLKTVv25ESySmowZLHbVwFjOQu2o1VY4CNRRvupngITWRRgs6uXFuBDEaSN9t0HkOnUqVNXDhpfKQNQoXOwxO6ind5H56YdQvfjcZqt94MxN0Sx9tX8hZ5D4W93o9WcqKlAuF6X-JDgnfZnTzb-BKLpnW79iOJIrqKe7kNzfRpo0mri3PJYQ61NNFhPnt5DIoUt_x8Mtb5z2C_hwLmSc0GCpK4GKf2W62oBSVyZp_ryBjhnMlKdLa8pf5Q6b6oV_Np_neSpqldHZ3My4BFWXqrQLHoYwyEa_YeYqdF2HIh0i102zNg3nA==&p=1&fvj=1&vjs=3
Senior Full-Stack Developer / Engineer (Mobile & Web) - Fully Remote,Metabolic Living,Remote,12 days ago,10-29-2020,"Keen understanding of algorithms, data structures, and time complexity analysis / big-O notation.
10+ years’ experience as a software engineer/web developer…","$125,000 - $150,000 a year",https://www.indeed.com/pagead/clk?mo=r&ad=-6NYlbfkN0B_MNPxj3wIboM-Pg3aIyhDQ0fnGYn4NhsByRbzZWqUuOnNPFjLiWbvckPMD9f-iYYYB00jQYq1rW-GSGkEX2cqLQpwYxUJqO2H0B6HDoelqhEzPUCFbc3AkY4N_CuF7VxHvKW8irbRXz4NXPJwzlPg46b4LZoPu5qwZ0QP3wDZLGbhAiQwNV4SC27_KIHCU3wr-9jdudRhVN2K81GcxmSiiscWRfZXK4RrgXpdxkZG1so8t4ZCFoUJxDZhXPEhRWTTivEWaRtczkkQkynmGAuph5IzbKSAM3Ni_Dp-Lhrge2RVSD7UsIK0bUJMS0ksIOA33QeAHaFGXhF6bnfdGjsm-9Ul7Jp7zVktVYzN7xxkbZOTGwNMm-Moy88yPGyNlWqj_PWiLcdM9foOER-br0FDHNPGqAnmQn73BHJQhaQhHg==&p=2&fvj=0&vjs=3
R&D Engineer,Hisense Photonics Inc,"Easton, PA",13 days ago,10-29-2020,Plans designs of experiments to optimize laser diode structures based on laser device modeling and detailed analysis of experimental data.,"$77,000 - $102,000 a year",https://www.indeed.com/pagead/clk?mo=r&ad=-6NYlbfkN0Dpfypl5QzlEktHHUNISqPPRl2AiLF8A2NhW8Sf0ao8ja5Yuse8RlZsJG7D8WESWA0IQP0qayrnI-wVowdOWaPIHIjdTGy4dwSpB-WOZjoQUR5NCRGwLpdEPdYn5DaVsj5-gxD-hlAm37V5ZrNfGOhaY0o0EIFLDlypiTb3rI16D2_GG9NRP55TkK66NT53ppQcPQO3qvensMStpKri0VpP-0oxNPkR6WvAPPSEPwOHLp8cdFYWcE0PdqPOR1F6iwT8gAlN6w95b2ED3AAI9nrM9lntgHx0WL3jzCUPt1TAqwYeEDKzgdczBU7QCH3KGs5rdd9nhEZkacBxWw94vQr59SmGmPT-Rh4Bbnid5-M5EL5DN-xZpAlqnPdfvjerxzuKRYhusyvDORmONDO1y_QZjNAUVhRl0vDvpCwa8nfzl30m8lSxqqDsw1xVaMIU6tH-tJFrtnNJ5A==&p=3&fvj=1&vjs=3
Data Engineer,Pilot Flying J,"Knoxville, TN",7 days ago,10-29-2020,"Create data products for analytics and data science team members to improve their productivity.
These solutions will generate insights from our connected data,…",,https://www.indeed.com/pagead/clk?mo=r&ad=-6NYlbfkN0BHJw5Gis_UoRXmUXA_4bvf0XyzDjfGlzFyeSANx3Gshl-qT9dYJlQ2U2QcKLS7YBsvRm8ygYeD4xnPU4wsbC7UJGShcu51N2M7sGUtkUx-4K3XYvx7WAcWqaHYDFI0esAROZAly6b2Qav1b-jma54sRWTnirF2byv8HN3B4z-DSIktH88Bo1bVGFaKae82JtiegICfLPYd-82OYrLW3HD3hm5EWrHMYMvG2nZQKiNfcytZfXK1FPYk4FeVcipEedZg-JCCK1bjUiCbpIkm8sY76bjzu7hgs2VIT4JI4_5ZAKiKkOiwIIQCbAYxDrL1V3IoAcdrakO2MU9RXe0LfeGYKy2a-2c64hY1nkR1sEzzuQXTRjumKajc1z30XUUv5C6CbYlTFZGrs-knWlmbuVSqOYuSHXHHm7fcQIsCyumC55jcaYUoUjKUxofiGRXxNmX67r19Oq5xgg==&p=4&fvj=1&vjs=3
Project Engineer,Gross Electric Inc.,"Utica, NY",3 days ago,10-29-2020,"Disseminates RFI data to contractors, architect/engineers, and LM personnel.
We are currently seeking experienced Project Engineers with at least 3 years’…",,https://www.indeed.com/pagead/clk?mo=r&ad=-6NYlbfkN0D_fz60vkiFRQ8AVFXZoJMGwU_mjlG4fD92_xiPDj5Bz8_CxDScNFF4_wsAPYORhVrmWir-1_-X2w-p7EzRV0fgvMVDN-SQcrTylxVQcFKpXXPq1DJRtJk2nBezuU8DxTo11JASwgJjoC0eHS5OLqmR39e7_j6AtKL6dSrHau04yf5x5rC8dfOh1T4XLxp2JaiDMADCrxXwCGpYVCQ6djuv5R8v86b3ceqor9UKDSYiv7XeanYH9-ovSSgx28pB9HGJcdQAYfQ-QjqQyQCAolu8fGkPUlJDS9YrXAxvKhf4nNjbnhn_Q1o5MmUBaI1AqXfYzmYJCOnj2SIZpF66TpE4BaFoFj0HlFeB2O2e9QvM0DH42M9GVYNOjESoTVl7FFkGf-yh7t2m6cwT7wEKfaJ8zANNOs7QO4YyeIS0C7tT6kLXm0hEycq5p1pX89mCeTb7vG4muwy8CQDRpx7RYAegG87jQBVoLeM=&p=5&fvj=1&vjs=3
