Title,Company,Location,PostDate,ExtractDate,Summary,Salary,JobUrl
Process Engineer,Infinitek,"Fort Lauderdale, FL",14 days ago,10-29-2020,"Computer literate in word processing and data entry.
This position will provide process engineering & maintenance support to the Manufacturing Facility.","$110,000 - $130,000 a year",https://www.indeed.com/pagead/clk?mo=r&ad=-6NYlbfkN0CdVvYvPABbMq-NuZBbmkV6SfpJ01HzJbDYZptDBLCnnNAg2-SEkIZ2FQdbbzKJ8KX84W2_5GC2wSzllx-Osg6y60MaXtLQg5nTuYpx6m0FhpVI4ahde19qLGLP01T8TDWrVIq1a_y-FMbr6EAJLfX9LPOV3I9zxgsOxDBz1VdIhkHzbYmOIOi9woDId0399hSXAa5EmcwcvDNnHToGO3RFhKoXJx10dPNggoRiRH5sl6FN6EdnAdp8zt_67t7_EYp1uZd7rgfyyoBms-d6XCCeNMcV2AU43_PiqO2exPCa8UgPmV0fkTZjvSMpyBLqx4kcNUZXpFQW8N8oAeZYIOuvzbqdzEN7sjRSOrzr_JY3iIwe36AW2u7db3ilLz3iwYmut6sAhf2KtHo3l-at1BGIgN3NunVHZ1Af9W1pfekFF8ppLSMtBnh4b98LiNDTU0KpvRiOvTfvNwcq0iDTtOY4&p=13&fvj=1&vjs=3
Data Engineer,Centerfield,"Los Angeles, CA",8 days ago,10-29-2020,"You will help design the data collection infrastructure in support of Centerfield’s Data Architecture.
Experience building reports and data visualization with…",,https://www.indeed.com/rc/clk?jk=7dd3a64a9612275e&fccid=6b69dc7df34f1cdc&vjs=3
Data Management Engineer II,GENENTECH,"South San Francisco, CA",3 days ago,10-29-2020,"2+ years of experience building on or managing data platforms, data infrastructure, metrics or pipeline management.
R expertise with tidyverse, shiny, caret.",,https://www.indeed.com/rc/clk?jk=8c1aab5655ce70fb&fccid=2525cc4a9a704809&vjs=3
Sr. Data Engineer,SmileDirectClub,"Nashville, TN",1 day ago,10-29-2020,"Design and build new dimensional data models and schema designs to improve accessibility, efficiency, and quality of internal analytics data.",,https://www.indeed.com/rc/clk?jk=f62c9e2f5e635d3c&fccid=d35e5e9ff3f4f2c3&vjs=3
Data Engineer,QSS,"Raleigh, NC",6 days ago,10-29-2020,"The strategy consists of an end-state robust and expandable model, data mining techniques, big data, data streaming, Data Lake, Cloud, visualization tools, and…",,https://www.indeed.com/company/Calibus-Inc/jobs/Data-Engineer-02f24604b0222a2e?fccid=9fe76e1d86e088e1&vjs=3
BI Analytics Engineer,Credible,"San Francisco, CA",2 days ago,10-29-2020,"1-3 years of work experience as a data analyst, data engineer, or in a highly analytical role.
Develop data models and schemas in our data warehouse that enable…",,https://www.indeed.com/rc/clk?jk=11ceb08ae2e33c8e&fccid=04e8134694cdee5a&vjs=3
Big Data Software Engineer,"Infinity Consulting Solutions, Inc.","Plano, TX",1 day ago,10-29-2020,"Acquire data from primary or secondary data sources.
Experience in data quality testing; adept at writing test cases and scripts, presenting and resolving data…",,https://www.indeed.com/rc/clk?jk=9e7f72141d9bec5b&fccid=95eedc2455f7362c&vjs=3
"Specialist, Data Engineer",3M,"Maplewood, MN",6 days ago,10-29-2020,"Strong knowledge of 3M legacy data systems (GEDW, MES, etc).
Two (2) years experience in enterprise BW/BI report development incorporating both SAP and legacy…",,https://www.indeed.com/rc/clk?jk=61bdd1545f60ce3e&fccid=595d42593839d3a2&vjs=3
Data Center Services Engineer,KCI Telecommunications,Remote,14 days ago,10-29-2020,"In-depth knowledge of the following: data center facilities management, backbone networks, server farms, large-scale storage area networks (SAN) and data center…","$60,000 - $150,000 a year",https://www.indeed.com/pagead/clk?mo=r&ad=-6NYlbfkN0A6uaqJ-WxMqUntV5oTzty4ctXSOFJND_U-7hmfE4uTAONs5OhQBGsKx0_LINfkSAo04oUmb7OIcJMWw1K8kRujAetkImbaiJNbPTFMp-nMjg9GGMTmopouf0q4WtMa31QdvmIDQi5Sg67pkSIyB652f_zEMtEdmyThow0MWByvcQgCnhct0MhuifuD2UvXu85JzVxF-zSOTKNZgAuGEEYRUf35_fT6K4tucKoORJ-W_L9_ERInK_NbIn34XKQkGGKolg8MvwThVsM5et4PZ4Kr2iMe0J8bXSqtO-V0856llyncSwB7mpeeBzuGQVS59kfLqyLtQMGZ9b7X9L97nOHGPRszxMnojmikORZk1QDuFgXMPtV5rXy42bx6Iu6wZRK5BKOCNcUS6viwg70RZr2zoIma3MpyHRbD0PgnR7HRCQU-QEJnN4t9TCKffUwQjnNPqWci9AWxMHyoa_ibEyg51ixcHOSZPXo=&p=6&fvj=1&vjs=3
Lead Data Engineer,FanDuel,"New York, NY",8 days ago,10-29-2020,"Designing and implementing complex data pipelines required in the data warehouse and data lake.
Create cost-effective data warehouse solutions with data that is…",,https://www.indeed.com/rc/clk?jk=d60ccbad183fdcff&fccid=ada833cd00ae27d8&vjs=3
Data Engineer (Remote),Cloudbeds,"Atlanta, GA",9 days ago,10-29-2020,"Strong knowledge of modern data lake, data warehousing, and ETL/ELT concepts.
Code ETL data transformations in PySpark/Spark.",,https://www.indeed.com/rc/clk?jk=ec670b1f54668605&fccid=88eab84b819c38e8&vjs=3
Azure Data Engineer,Capgemini,"Atlanta, GA",1 day ago,10-29-2020,"2 years’ experience in leading the design, development, and deployment of end-to-end solutions (including data acquisition, data ingestion, data storage, data…",,https://www.indeed.com/rc/clk?jk=d5a2567c48637c5d&fccid=105ecfd0283f415f&vjs=3
Sr Big Data/Data Engineer,Inceed,"Houston, TX",1 day ago,10-29-2020,"This person will be responsible for leading the design, development and implementation of application systems to meet business needs.",$55 - $75 an hour,https://www.indeed.com/pagead/clk?mo=r&ad=-6NYlbfkN0AoBNnhwaemRAOYHpUmcUH3kMsCSpKBJJRmoHC-YTpRnKon-9Q9ccBxA2-HqZ5NGjN0Wd2PP-fQpf-nSRIaN3-3o2yzMSX_5Cw-b3UQRITsZyHmihPHeHHtRhJYqgx8Bm3mzHrUhfyz3NjB_4ROVHCohsnUem3PZqWd8fYnv42UvR1ScTCz4RPPq8ihda0pBNuloRyc2YJFQ7gDbQZFbSVucD6SCUTntvWDFy9qWFGdSBUCFj94bakmgfvmUjeTbui-oTrI6bG_DKqGx_kShi82y_s35RFIbUao7jVHHMCRQyy85lL13Yt-RYcKuowMZ-h_LmD7eocNQdKMuNhfO3Iws9RqNQX1JGSEe-y1D5OX8iUf3hqNamO34yXFnzVcMstWeJaJD6bL2vKgQyMNJVfCMDl4OG4ky6zEiKm_ApYAa6AqsoN_rweqkuBNXoVV2Pc2RIQdhh7-_777l9nZe-9YklzDMO4bgAo=&p=10&fvj=1&vjs=3
"Software Engineer, Full Stack - Data Visualization",TuSimple,"San Diego, CA",6 days ago,10-29-2020,"Working with developers in the company to understand data inside the vehicle system.
Making decisions about APIs and data flow considering usability,…",,https://www.indeed.com/rc/clk?jk=df181fb1d79b972e&fccid=fea34c44eddebdae&vjs=3
"Data Engineer, R&D",Zoetis,"Kalamazoo, MI",6 days ago,10-29-2020,Support the digital analytics team by automating the transforming and shaping of data from disparate internal and external data sources.,,https://www.indeed.com/rc/clk?jk=5e99133fa240fa8d&fccid=745f1dbed6d65d32&vjs=3
Lead Data Engineer,InVisionApp,California,6 days ago,10-29-2020,"Provide leadership to other data and infrastructure engineers on the team.
Maintain and evolve our data platform (data lake, data warehouse, ETL, and BI tools).",,https://www.indeed.com/rc/clk?jk=09db418571f04dc3&fccid=f20751a8586b0998&vjs=3
Data and Machine Learning Engineer,WEX Inc.,Remote,8 days ago,10-29-2020,"Have experience extracting data from APIs.
Have experience writing data engineering code and scripts.
Have experience with cloud data tools such as BigQuery,…",,https://www.indeed.com/rc/clk?jk=6a5f0ec5d3dc11f6&fccid=c9538b927313f8e0&vjs=3
Data Engineer,Rad Power Bikes,"Seattle, WA",14 days ago,10-29-2020,"Utilized and built out the data warehouse foundation and set up the pipes for data sources.
Designed schemas, optimized data transformation, and managed…",,https://www.indeed.com/rc/clk?jk=204fdd27df969de7&fccid=2b732511b96d1e64&vjs=3
"Staff Engineer 2, Data Pipeline - HBO Max",HBO Max,"Seattle, WA",2 days ago,10-29-2020,"The data pipeline is where we instrument, store and model engagement and reference data for use by analysts, data scientists and engineers to enhance and…",,https://www.indeed.com/rc/clk?jk=85a1ad8a1acacac7&fccid=a710372f724c1e2e&vjs=3
"Staff Software Engineer, Data (Growth Team)",Robinhood,"Menlo Park, CA",2 days ago,10-29-2020,"Engineering fast, real-time data pipelines to process data from across the financial markets and our internal event streams.",,https://www.indeed.com/rc/clk?jk=ab8da9278a891cd7&fccid=fba1f219793d6b80&vjs=3
Biomedical Data Engineer,Penumbra US,"Alameda, CA",13 days ago,10-29-2020,"Experience with basic data structures and algorithms.
Familiarity with data modeling and machine learning preferred.",,https://www.indeed.com/rc/clk?jk=84078022548be99b&fccid=48d4b5e592158b7c&vjs=3
Data Integration Engineer - 100% Remote,IST Inc.,Remote,1 day ago,10-29-2020,"Top skills are Python, data warehousing, SQL querying, SQL server.
Key thing we are looking for: We are looking for a resource who has previous data…",$45 - $50 an hour,https://www.indeed.com/company/IST/jobs/Data-Integration-Engineer-6eece856a015e0f3?fccid=96b4f9094d1b0c57&vjs=3
AI & Data Software Engineer,LR Strategic LLC,"San Francisco, CA",9 days ago,10-29-2020,"A commitment to data quality, security, and privacy.
Curating data and systems to build out and maintain internal and external APIs.",,https://www.indeed.com/company/LR-Strategic/jobs/Ai-Data-Software-Engineer-c62b1ffb1dd6e7ab?fccid=67d1f03791a5f605&vjs=3
Engineer Data Center Operations,TCS,"Redmond, WA",5 days ago,10-29-2020,"Engineer-Data Center Operations 1. Apple Certified ACMT 2. MacOS, iOS, Windows, Windows server 3. Certified Google IT support professional Job Function…",,https://www.indeed.com/rc/clk?jk=1568c297af2411f0&fccid=c78fdfc4443d4537&vjs=3
Data Engineer,Spartan Technologies,"Atlanta, GA",14 days ago,10-29-2020,The person hired will be an experienced data engineer that enjoys optimizing data systems and building them from the ground up.,,https://www.indeed.com/rc/clk?jk=c970367bac3800df&fccid=d4243aec81760af8&vjs=3
Data Engineer,Amplify Consulting Partners,"Bellevue, WA",9 days ago,10-29-2020,"Shape how we capture data to improve our test-driven methodologies and build a culture around data driven development.
3+ years’ experience with SQL Server.",,https://www.indeed.com/rc/clk?jk=d36855b894028a6c&fccid=5c10e426c0ae71ba&vjs=3
Data Engineer,Huckleberry Insurance,"San Francisco, CA",12 days ago,10-29-2020,"Build tooling that can be used by other engineers to capture essential product-related data.
Drive the collection of new data and the refinement of existing…",,https://www.indeed.com/rc/clk?jk=2d8854a268f5d471&fccid=cff710ddd500db7d&vjs=3
Wafer Fab R&D Engineer,TRUMPF INC,"Cranbury, NJ",Just posted,10-29-2020,"This engineer will execute on key projects related to Wafer Fab process development.
Hands on operation of process and measurement equipment, processing wafers,…",,https://www.indeed.com/pagead/clk?mo=r&ad=-6NYlbfkN0DAajJOpGahrbyAr0h8cwItWt2bvbpcx7h8ci7DZnKRL4oFB79tAPr5p1rhD4hBDY48iEE5LJnqsKArZJURAJpmCihtylYbKHaFpgN1YHiJYkOkFb_PD3nXBmljApQhz0YueIE2oA-hkqy2S2pqJ-YjLK8Oct-yN_8s86zdBqDJFnhT64pD5GylvfKk-GAwQMtyXFSc2xo--cmJ0Ypt--G4b3DIaxK7UvgO9jUMAKHjF9ft-SMrVFOa4UWmiT37oCl82ledA0subRPxRBkUB_kmLIg4ZnhSraYyLAjDdOm8eci1wQVy3m4RExjp7bv0KbCz8k77T9hIEA1AW9keoQH_-KbvfAZsjXrlptI1qmquyeI3YdRrvIKOsXChFgoSNd-oxOXILJyN8Et6yxd7wpFIJHznYp1LJXnWJVqaviFZLpRJ5S2idkO62rouDogSP-A-eUI1o9s89UnlGsmHco05rTbguuGAauCAlHNGeCw5TRrjpOjFIDBen_v4YC99_qJYyXxiBF4oocdw6zIhH0tfuxtsE_EbiO2nTDaa9pKyuA7aMVf89682fqfnBig7T-V9qsUtFLMKZ6DjdBo0gNWR715EZ5QUBUoU_RXnZli5QeL-VsJo4YrgrDHSP8-fcZrsxLAZCw6GNeRp8DyiFb76eeuI5wDLuVqaIb-fsTZh1ZWfXJDCCElHIsqHuwOi4Q7Endh5_QA6uMEN2T4igiuJ5ICsBhrsGI50HiQ1ygaTnXRVd5Pcup0V7ZXlmgRGKBqm77evnCGPVlCVDyUxJfJD3kolu0MI28c=&p=10&fvj=0&vjs=3
Data Engineer - Mid Level,USAA,"Fountain Hills, AZ",2 days ago,10-29-2020,"Analyze data and enable machine learning.
Help on-board entry level engineers.
Data Engineers deliver quality reporting and data intelligence solutions to the…",,https://www.indeed.com/pagead/clk?mo=r&ad=-6NYlbfkN0CdTBpsLrhs4IwmIsoO0brdHaF9POTtXIeJjdlamKYQ_HWXH6wnIvGc8UGs1d70_o1FI6_nx3Fvo4mnocXf6yaCsbKn7mQJCkxHvx-6rVs0rcRSlzTxru6TFjlOrXzTMzAkT_j8w-DMVAQLSbcCdD9RaABWgQ0Kxkp9MVf491ElZ3-iEFW55bjNm1T6XtCY2Y65_7QNqF6ULECtbrFXDEowzkofvgsSrOZ_EHM33nGSYn8qNQd7Yw-3abYDMdPjRf39E4U2kO5Q6pmCFif5RSYcVD77U7IB1xSLYmkpiN6m34vWKsLY3MZqIJAKdbYYUMU760dm8UFMQIAa1unhVNBZk3a3gGvF_LYT-6U0ts7F4EZ_yD_ReUA-YyUaW1u4lJY=&p=11&fvj=0&vjs=3
Senior Data Engineer,Progressive IT,"McKinney, TX",7 days ago,10-29-2020,"The data engineer will be handling the design and construction of scalable data management systems, ensure that all data systems meet company requirements, and…",,https://www.indeed.com/pagead/clk?mo=r&ad=-6NYlbfkN0Cy7Od_y0M8ZhqDgWHqI0USuJAjTvWZLWS1aAu4pUc1rEcG0_XGczRA_tOrSrHN2lnqmXAClfESpOitgNC5Nyd050hNo2pAvrwmH2xEeVTRCIpbJce4_GCl6DAE4XnKRj6iJrVibKV0qELWpRf98kb2G2YXw_2Scox-VkzQ3O8O1JCxMxpBOOlElPg2FHcd5R0L6et1pNA4IRq2BQ5CjLFlX6pDOpRdpTCyIA7lO_D89mwFtOXKx5BQjC9h5O0OOnnVMU70yH9EbrveMYAMK-7QX2o0qaTDsz23wFurICxRXPaopelZYYyhU5MwOwxJScoGHD-_Re4YFe4UYKKsh0AEUp6CniK22dHZeKZCG0hzv7XzMoQw38PS4V7uZlU8qRd5il7DKtjCfYtiEFtHPeunASXjLqB78AVCQkDoLFcdwr9XUwqETBN7O8nqsflNP5CfwQrNtYvuVOq8-r_aeNjEtj_YvWmITOqRv31rJpqZWUiZ9KzWdAp17jzV15-y-x4gdvFFGfxGBPfIH_DNUm5vQ2gmUkFhVxTPayLfbj-ZtkYOLhXLsh2y2Hl_P8IMGgTVX-WDYKwJlL4MMdYgJCdnURaUIC2qf64CFr02VEx5rA==&p=12&fvj=0&vjs=3
Data Engineer,Pilot Flying J,"Knoxville, TN",7 days ago,10-29-2020,"Create data products for analytics and data science team members to improve their productivity.
These solutions will generate insights from our connected data,…",,https://www.indeed.com/pagead/clk?mo=r&ad=-6NYlbfkN0BHJw5Gis_UoRXmUXA_4bvf0XyzDjfGlzFyeSANx3Gshl-qT9dYJlQ2U2QcKLS7YBsvRm8ygYeD4xnPU4wsbC7UJGShcu51N2M7sGUtkUx-4K3XYvx7WAcWqaHYDFI0esAROZAly6b2Qav1b-jma54sRWTnirF2byv8HN3B4z-DSIktH88Bo1bVFUjcHPReUB65xxtnyXgw0uHvQR1NnGTmKKj4uxAX9wtlBI1dk_2tWWKxMmxlpKbS3hpj__fP6lISE-6sesJsF4_iizbP0m8J2P-yVXut-BKcscNa7KJ4IOrPyrR17hwIfv_5Xinue-dpw0QiRqAgi6eep-WVnk7LugjdtIaU42oHZUyzBuyBUqq_xNL9IVD7MbmRb19l7Wpiv_WG9WGadPj0Bn3A7voxLONJdp9uvjQpWEoBY3Ou7vWa9o_nsfX7A6y5iinIHiMYTLs6oV-8DA==&p=13&fvj=1&vjs=3
Analytics Data Engineer,Progressive Leasing,"Draper, UT",13 days ago,10-29-2020,Help team operate current data platform (on-prem SQL Server) while migrating to new data platform (Snowflake) using a new data transformation architecture.,,https://www.indeed.com/pagead/clk?mo=r&ad=-6NYlbfkN0CsuTosJrKfN6wH8BQbOMsKYbjQjiuM_l9NzspF6LlLlBRlMp1H1XwiQLR_b-ITnmgz6KDoZkDdCWAJFDyCpxzvX8-XNAprT7l_qYLp_48OwNpRsqBrgLy1EOsUpebnzzpfIuPGR2aguEFjg_NUpWuErpaglGfeCgl2_4QlqhWQFPsrH99oia52oFPclG5mhoI_Yy05mwYjCmSgRNkl3IW8gH_HYq03canBYEohE0sWImX6Jy2qtoas1ILHcTyZjBQ6ZlGpMfFG6dGpAhgz-CAEG7qnk5XxUrVt2JRXVIbZmgc2BWMeXgNxXtB1jnFY9TT0y0C149ZZ7Di-o2yq4MKKhKcoVgktaq3JWEAZZtNzbSyzkgUtBjeTR2LjUYMzthKCSmYbH8DGm3vhunGpN0V2czgFysfdP5MVDxBTGDt2iivkmhigxrZsfEMDdS4SW-zaRt7YgeTE80qrB6JE2K5sF7TPn6R7cJ22c7ZYEkjQJkTUDdyr1dacq16VScAa9JoM8rYQJQvwo486a-9zgYFMg6nWUtXyqmoWvnKuD9KH_uUuSIb-xG0Vg06aYTtGAD-mH8kym7lp2sqsGQWMwKNlioEKw9J5gJmFdRCUNAhd586OqQA1AqxcoOwQmHRdlQWabihznXA1heMitdw0U6J1l7nSRR0hq_PQoly2YDNy0VrlF2qNZDzq&p=14&fvj=0&vjs=3
Business Intelligence Data Engineer,Golden State Foods,"Irvine, CA",14 days ago,10-29-2020,"Provide application analysis and data modeling design to collect data for centralized data warehouse.
Map source system data to data warehouse tables.",,https://www.indeed.com/pagead/clk?mo=r&ad=-6NYlbfkN0AbRDI-lGFs5QlqkohoUB2e5sgCs9HeEJ9hgGj-UwEHEp6HU_wDtQH-DctAHXoIBBURi2bymK4Y27QbYvWtXiEiDWi44xXKOyQ46pBE_CTCeWXG2gZDuByA9p-d1lxLoK_Vqk0G1RPuYiqs8ZY33sIm4buAabCv7BodlzvEQOYMi01Z-RYc0SRnR10v4Sk07RBnEpE2SwSCfir0MosqON7XHRN5INec2kJWfEbIKmj6sreLwyvDVx3lzSmH0i72E80w46KOknUFaqYdZ8mPRjn3nTSjDsS4KmmUqWU2JT-mTH_-k8og8FrMGmmjmercEw6Mng8WKc3qRjFxSi_LG-MWovG2LzeLF5hsiA_ZpH7JtWGrpHl8XeKAD3xdO3TW9gq99MzKTpcYhMzUV5bjj7kTAuqJ8fBCKd96yDX_YE1DV01aiiPnEOca6W_lRchii0oUoNIK6Cy2PKVEfst1lKs1q7cy--GVg7xXQRCFURnCvA==&p=15&fvj=1&vjs=3
Data Engineer,JONDO,"Yorba Linda, CA",6 days ago,10-29-2020,"Some experience working with batch data, especially Facebook data, Google Analytics data, or any shipping carrier and payment system data.","$70,000 - $90,000 a year",https://www.indeed.com/pagead/clk?mo=r&ad=-6NYlbfkN0DV_TdDxrYPaTDvkiuz_Y8pxbdDODa2wCuSej1y-Wbu4PYd-dGGF4dMg2z5re39qwa6lXoFfUGQmMvaHDMOXczQ8YioJdau3aiNzu3536mweeYHB8fHB5atFHYiTrwrxRGNOu6IUr1u8RjBnaAAvaoltPLKTVv25ESySmowZLHbVwFjOQu2o1VYU0ibChQRdsm2LCQNnEi4trssFdxdyNvKBe1zf3T4a-OvJKaiD9ozPvyih9-impl5XxaEtJbvVqxdRXt1w8ezG5x3dmObWWTPUeXG787ZOSP0BGJRIWd7BQBDWb9EJBl94m6RnXh91P7O90xr6ejAmTszAUb3-DbGREFpBmtTjpUNO-LHGte93tzGsSkomDVq66LiGMu0aEz60_RVpwYxBUqSq7GlqI2LM6msTmQeYjeYix2J6Q_KV_FxFRnVsop0wxex-qDi1b7uN921YwNH0A==&p=16&fvj=1&vjs=3
Senior Full-Stack Developer / Engineer (Mobile & Web) - Fully Remote,Metabolic Living,Remote,12 days ago,10-29-2020,"Keen understanding of algorithms, data structures, and time complexity analysis / big-O notation.
10+ years’ experience as a software engineer/web developer…","$125,000 - $150,000 a year",https://www.indeed.com/pagead/clk?mo=r&ad=-6NYlbfkN0B_MNPxj3wIboM-Pg3aIyhDQ0fnGYn4NhsByRbzZWqUuOnNPFjLiWbvckPMD9f-iYYYB00jQYq1rW-GSGkEX2cqLQpwYxUJqO2H0B6HDoelqhEzPUCFbc3AkY4N_CuF7VxHvKW8irbRXz4NXPJwzlPg46b4LZoPu5qwZ0QP3wDZLFzyUstYjPkpT2VXQhR4K3QNwxu8Z1xBbUuo1az8aqry71Sj-4-eIjUgkoaCcGFp0HkrtxpIAf5KS0Gd6mppgUbOAwWsuyEgnfMjSBqvQUYIxUyNx8wAowkJfYLgVi8xkilafCgNK8phe7BxOgH3XoXrua3b_k8Kb-gHUAzHkz58RKQUsntCcmsOY5Z7MO9YpYtG9Kn3vpnHUplyq_dUcTEKAdxWupA7A5CFMEHuc7bJqCRqpz31LlwdEe2samN3Kw==&p=17&fvj=0&vjs=3
Data Engineer,"7-Eleven, Inc.","Irving, TX",7 days ago,10-29-2020,"Participating in designing new data applications.
Developing and implementing different aggregations, features and builds data pipelines to solve different…",,https://www.indeed.com/rc/clk?jk=5278f941c225b4cd&fccid=e22ec123cbb88199&vjs=3
Data Engineer,Browse Info Solutions.,"Canton, MI",3 days ago,10-29-2020,"Data engineer will also contribute in the design of new data lake components and data marts.
Build data engineering expertise and own data quality for ingestion…",,https://www.indeed.com/rc/clk?jk=374effccf814b4b1&fccid=f76db06c3a4c2067&vjs=3
Data Engineer,Mythical Games,"Los Angeles, CA",12 days ago,10-29-2020,"Design and build robust data pipelines ETL'ing from multiple data sources.
Manage and inform data warehousing design.
Bachelor's Degree in a technical field.",,https://www.indeed.com/rc/clk?jk=c3a12313a281b9f3&fccid=79fb05417322f0aa&vjs=3
Research Data Engineer - Penn Center for Computational Social Science,University of Pennsylvania,"Philadelphia, PA",Today,10-29-2020,"A subject matter expert in one or more technical areas: data architecture, data engineering within big data systems such as Hadoop and SQL.",,https://www.indeed.com/rc/clk?jk=fc93fb72a2107574&fccid=ebd944f3c244d667&vjs=3
"Data Engineer, Associate","JPMorgan Chase Bank, N.A.","Lewisville, TX",12 days ago,10-29-2020,"Implement business and IT data requirements through new data strategies and designs across data platforms.
Minimum 5 years experience in Information Technology…",,https://www.indeed.com/rc/clk?jk=eaba662851a62e18&fccid=aaf3b433897ea465&vjs=3
Data/Machine Learning Engineer,Route,"Lehi, UT",9 days ago,10-29-2020,"Proficient SQL skills and experience with data wrangling.
Build and maintain our data pipelines to keep them stable, performant and accurate.",,https://www.indeed.com/rc/clk?jk=f34ab111d4556128&fccid=dd616958bd9ddc12&vjs=3
Data Center Services Engineer,KCI Telecommunications,Remote,14 days ago,10-29-2020,"In-depth knowledge of the following: data center facilities management, backbone networks, server farms, large-scale storage area networks (SAN) and data center…","$60,000 - $150,000 a year",https://www.indeed.com/pagead/clk?mo=r&ad=-6NYlbfkN0A6uaqJ-WxMqUntV5oTzty4ctXSOFJND_U-7hmfE4uTAONs5OhQBGsKx0_LINfkSAo04oUmb7OIcJMWw1K8kRujAetkImbaiJNbPTFMp-nMjg9GGMTmopouf0q4WtMa31QdvmIDQi5Sg67pkSIyB652f_zEMtEdmyThow0MWByvcQgCnhct0Mhu_0YYiqM5Da0l0wSiYZYbh4ZXp76-JZpc_j7hQgLNTNtemAR-Y1OyMsLrZ_sz11P4gjFHzZUogm3w8T5WX4VZmw8Aj5ANJHNb7JHhrQXTu-MLGYy8UOkgS4FCpaLgu2FoZVrm1PgoOHKKbD7RAPK-_LljKGDwi-LIdmNuCnIsyZ0ZX2bEsK4h0n7Y74ONW_pugrRmKIM-fvCLWN3LIR3LOMZ9qCrpjGcpixlxDrgc81CC_vRfOTs87C73106gt0lc-tZABOvhaGJa9QXXvQ2Kyb8312ULmMP-3oRd7yWQd2Q=&p=6&fvj=1&vjs=3
Marketing Data Engineer,Wheelhouse DMG,"Seattle, WA",9 days ago,10-29-2020,"Two to three years of experience as either an analytics engineer, data engineer, solutions architect, or data architect preferably in proximity to marketing…",,https://www.indeed.com/rc/clk?jk=b3b1bf886be45f18&fccid=5078f0f0db002cd3&vjs=3
Database Engineer,Medisolv Inc,"Columbia, MD",8 days ago,10-29-2020,"Healthcare data and data standards (Standard code systems, quality reporting, etc.).
Experience performing data analysis and calculations within a database…",,https://www.indeed.com/rc/clk?jk=c9b16c10a1f06c31&fccid=b0e6bd33182ca24b&vjs=3
Data Center Network Engineer openings,ClientSolv Technologies,"Littleton, CO",1 day ago,10-29-2020,"Design and engineering of effective and scalable network systems and solutions.
Participate in evaluation, testing, selection, and deployment of foundational…",,https://www.indeed.com/rc/clk?jk=9cfecad3730e2472&fccid=d25525f95db539b9&vjs=3
Data Engineer,CVS Health,"New York, NY",13 days ago,10-29-2020,"Builds data marts and data models to support clients and other internal customers.
Integrates data from a variety of sources, assuring that they adhere to data…",,https://www.indeed.com/rc/clk?jk=cd6a9cea8f19de70&fccid=be3b11aa573faee7&vjs=3
Data Engineer,Digital Dhara,"Columbus, OH",2 days ago,10-29-2020,"The Data Engineer will support our software developers, database architects, data analysts and data scientists on data initiatives and will ensure optimal data…","$100,000 - $110,000 a year",https://www.indeed.com/company/Digital-Dhara-LLC/jobs/Data-Engineer-6da842872b74e5c6?fccid=c77b76135d73a183&vjs=3
Data Science Engineer - TPG,Micron,"Boise, ID",Today,10-29-2020,"Drives action through effective data presentation and data story telling.
Drive needed improvements with IT/Host teams for data availability and data collection…",,https://www.indeed.com/rc/clk?jk=e08ff203d9916356&fccid=be240c643a8631c5&vjs=3
AWS Cloud Data Engineer,Prime Health Medical,"New York, NY",7 days ago,10-29-2020,"Experience building and optimizing ‘big data’ data pipelines, architectures and data sets.
Build the infrastructure required for optimal extraction,…",,https://www.indeed.com/company/Prime-Health-Medical/jobs/Aws-Cloud-Data-Engineer-b029b7787f4156c2?fccid=17488667ac7bce31&vjs=3
Implementation Engineer,Softvision,"Sioux Falls, SD",3 days ago,10-29-2020,This position is responsible for the technical delivery and data transfer analysis of product solutions to end users in the banking financial services industry.,$51 an hour,https://www.indeed.com/company/Softvision/jobs/Implementation-Engineer-c24d3cf519f5feab?fccid=bc6d68ab22143afb&vjs=3
AWS Cloud Data Engineer,Prime Health Medical,"New York, NY",7 days ago,10-29-2020,"Experience building and optimizing ‘big data’ data pipelines, architectures and data sets.
Build the infrastructure required for optimal extraction,…",,https://www.indeed.com/company/Prime-Health-Medical/jobs/Aws-Cloud-Data-Engineer-b029b7787f4156c2?fccid=17488667ac7bce31&vjs=3
Implementation Engineer,Softvision,"Sioux Falls, SD",3 days ago,10-29-2020,This position is responsible for the technical delivery and data transfer analysis of product solutions to end users in the banking financial services industry.,$51 an hour,https://www.indeed.com/company/Softvision/jobs/Implementation-Engineer-c24d3cf519f5feab?fccid=bc6d68ab22143afb&vjs=3
"Data Engineer, Alexa Shopping",Amazon.com Services LLC,"Seattle, WA",11 days ago,10-29-2020,"Experience with data modeling, data warehousing, and building ETL pipelines.
Experience providing technical leadership and mentor other engineers for the best…",,https://www.indeed.com/rc/clk?jk=01faa1cfd1b7c309&fccid=fe2d21eef233e94a&vjs=3
Data Integration Engineer,Cetera Financial Group,United States,Today,10-29-2020,"Sound understanding of data warehouse best practices, relational data structures and dimensional data modeling is required along with strong SQL skills.",,https://www.indeed.com/rc/clk?jk=acf47d98250d6a15&fccid=32dda9721fdfaba8&vjs=3
Software Engineer Apprentice Conversion,IBM,"Littleton, MA",2 days ago,10-29-2020,"IBM provides you with the most comprehensive and consistent approach to development, security and operations across hybrid environments—with complete software…",,https://www.indeed.com/rc/clk?jk=38ec0104ee93995d&fccid=de71a49b535e21cb&vjs=3
Data Engineer,Save-A-Lot,"Saint Ann, MO",14 days ago,10-29-2020,Create data interfaces to integrate data from internal and external systems to Cloud data platforms to support enterprise-wide data consumption.,,https://www.indeed.com/rc/clk?jk=9fc5ece289b481c1&fccid=1bb1e19207a4ec89&vjs=3
Cloud Data Engineer,"Cottonwood Financial Administrative Services, LLC","Irving, TX",Just posted,10-29-2020,"Add new data sources to data lake.
Translate business requirements into data harvesting prototypes (e.g. develop code to connect to APIs of new data sources for…","$72,200 a year",https://www.indeed.com/rc/clk?jk=dbb660a2885cbe52&fccid=fef9a3c70c369a2c&vjs=3
Frontend Engineer,Dwelo Inc,United States,3 days ago,10-29-2020,"Collaborate with other engineers on the design of APIs to enable new user interfaces.
Work with software engineers in test to make these frontends automatically…",,https://www.indeed.com/rc/clk?jk=b6f38e7a2be8be5b&fccid=5da9146d70f34578&vjs=3
Data Center Chief Engineer,"Amazon Web Services, Inc.","Chantilly, VA",Today,10-29-2020,"4+ years of data center or mission critical facilities (example: hospital, military facility, public safety facility, etc.) experience.",,https://www.indeed.com/rc/clk?jk=de9d2cabee5d3f3d&fccid=fe2d21eef233e94a&vjs=3
Big Data Engineer-Hadoop,Emonics LLC,"Jersey City, NJ",3 days ago,10-29-2020,"Candidate Must be from STEM background (Computer Science, Information Technology graduates will be preferred).
Candidate Must have good communication skills.","$60,000 - $110,000 a year",https://www.indeed.com/company/Emonics-LLC/jobs/Big-Data-Engineer-Hadoop-a305e301ccd24a34?fccid=28ce6cdf6e3af83d&vjs=3
